numero_identificador,data_atualizacao,tipo,titulo,ano,pais,evento,cidade,periodico,editora,descricao,autores
9782653543954493,30052024,Artigo Publicado,Influence of Waste Glass on the Physical Properties of Portland Cement Concrete,2014.0,,,,Materials Science Forum (Online),,,"Edson Jansen Pedrosa de Miranda Júnior (MIRANDA, E.J.P.), PAIVA, A.E.M. (PAIVA, A.E.M.), RODRIGUES, ERMERSON NEY LEITE (RODRIGUES, ERMERSON NEY LEITE)"
9782653543954493,30052024,Artigo Publicado,Increasing the compressive strength of Portland cement concrete using flat glass powder,2014.0,,,,Materials Research (São Carlos. Impresso),,,"Edson Jansen Pedrosa de Miranda Júnior (MIRANDA JÚNIOR, EDSON JANSEN PEDROSA DE), BEZERRA, HELTON DE JESUS COSTA LEITE (BEZERRA, HELTON DE JESUS COSTA LEITE), POLITI, FLÁVIO SALGADO (POLITI, FLÁVIO SALGADO), PAIVA, ANTÔNIO ERNANDES MACÊDO (PAIVA, ANTÔNIO ERNANDES MACÊDO)"
9782653543954493,30052024,Artigo Publicado,Determinação Experimental do Coeficiente de Transferência de Calor por Convecção,2016.0,,,,Ifes Ciência,,,"Edson Jansen Pedrosa de Miranda Júnior (MIRANDA JÚNIOR, E. J. P.), Rubens Soeiro Gonçalves (GONCALVES, R. S.)"
9782653543954493,30052024,Artigo Publicado,Effect of Flat Glass Powder on the Slump Test and Microstructure of Portland Cement Concrete,2016.0,,,,Materials Science Forum (Online),,,"Edson Jansen Pedrosa de Miranda Júnior (MIRANDA JR., E.J.P.), PAIVA, A.E.M. (PAIVA, A.E.M.)"
9782653543954493,30052024,Artigo Publicado,Influence of Particle Size and Soak Conditions of the Species Simarouba amara</i> on Cement-Wood Composites,2016.0,,,,Materials Science Forum (Online),,,"BEZERRA, H.J.C.L. (BEZERRA, H.J.C.L.), PEREIRA, S.J. (PEREIRA, S.J.), Edson Jansen Pedrosa de Miranda Júnior (MIRANDA JR., E.J.P.), PAIVA, A.E.M. (PAIVA, A.E.M.), POLITI, F.S. (POLITI, F.S.)"
9782653543954493,30052024,Artigo Publicado,Elastic Wave Band Gaps in a Two-Dimensional Magnetoelectroelastic Phononic Crystal,2016.0,,,,Revista Interdisciplinar de Pesquisa em Engenharia - RIPE,,,"Edson Jansen Pedrosa de Miranda Júnior (MIRANDA JÚNIOR, E. J. P.), José Maria Campos dos Santos (DOS SANTOS, J. M. C.)"
9782653543954493,30052024,Artigo Publicado,Comparative Study on Plasma Nitriding in Cathodic Cage with Conventional Nitriding of the Austenitic Stainless Steel 316,2017.0,,,,International Journal of Current Research,,,"Marcelo Caethano Souza Cabeça (CABECA, M. C. S.), Samuel Filgueiras Rodrigues (RODRIGUES, S. F.), André Silva Neto (SILVA NETO, A.), Edson Jansen Pedrosa de Miranda Júnior (MIRANDA JÚNIOR, E. J. P.), Gedeon Silva Reis (REIS, G. S.), Antônio Maia de Oliveira (OLIVEIRA, A. M.)"
9782653543954493,30052024,Artigo Publicado,Band Structure in Carbon Nanostructure Phononic Crystals,2017.0,,,,Materials Research-Ibero-american Journal of Materials,,,"Edson Jansen Pedrosa de Miranda Júnior (MIRANDA JÚNIOR, EDSON JANSEN PEDROSA DE), SANTOS, JOSÉ MARIA CAMPOS DOS (SANTOS, JOSÉ MARIA CAMPOS DOS)"
9782653543954493,30052024,Artigo Publicado,Flexural Wave Band Gaps in Phononic Crystal Euler-Bernoulli Beams Using Wave Finite Element and Plane Wave Expansion Methods,2018.0,,,,MATERIALS RESEARCH,,,"Edson Jansen Pedrosa de Miranda Júnior (MIRANDA JR., EDSON JANSEN PEDROSA DE), SANTOS, JOSÉ MARIA CAMPOS DOS (SANTOS, JOSÉ MARIA CAMPOS DOS)"
9782653543954493,30052024,Artigo Publicado,Phononic Band Gaps in Al2</sub>O3</sub>/Epoxy Composite,2018.0,,,,MATERIALS SCIENCE FORUM (ONLINE),,,"Edson Jansen Pedrosa de Miranda Júnior (MIRANDA JR., EDSON JANSEN PEDROSA), DOS SANTOS, J.M.C. (DOS SANTOS, J.M.C.)"
9782653543954493,30052024,Artigo Publicado,Complete Band Gaps in Nano-Piezoelectric Phononic Crystals,2017.0,,,,Materials Research-Ibero-american Journal of Materials,,,"Edson Jansen Pedrosa de Miranda Júnior (MIRANDA JR., EDSON JANSEN PEDROSA DE), SANTOS, JOSÉ MARIA CAMPOS DOS (SANTOS, JOSÉ MARIA CAMPOS DOS)"
9782653543954493,30052024,Artigo Publicado,Evanescent Bloch waves and complex band structure in magnetoelectroelastic phononic crystals,2018.0,,,,MECHANICAL SYSTEMS AND SIGNAL PROCESSING,,,"Edson Jansen Pedrosa de Miranda Júnior (Miranda Jr., E. J. P.), DOS SANTOS, J.M.C. (DOS SANTOS, J.M.C.)"
9782653543954493,30052024,Artigo Publicado,Flexural wave band gaps in a multi-resonator elastic metamaterial plate using Kirchhoff-Love theory,2019.0,,,,MECHANICAL SYSTEMS AND SIGNAL PROCESSING,,,"Edson Jansen Pedrosa de Miranda Júnior (MIRANDA, E.J.P.), NOBREGA, E.D. (NOBREGA, E.D.), FERREIRA, A.H.R. (FERREIRA, A.H.R.), DOS SANTOS, J.M.C. (DOS SANTOS, J.M.C.)"
9782653543954493,30052024,Artigo Publicado,Rubberized mortar: The influence of aggregate granulometry in mechanical resistances and acoustic behavior,2019.0,,,,CONSTRUCTION AND BUILDING MATERIALS,,,"ANGELIN, A.F. (ANGELIN, A.F.), Edson Jansen Pedrosa de Miranda Júnior (MIRANDA, E.J.P.), SANTOS, J.M.C. DOS (SANTOS, J.M.C. DOS), LINTZ, R.C.C. (LINTZ, R.C.C.), GACHET-BARBOSA, L.A. (GACHET-BARBOSA, L.A.)"
9782653543954493,30052024,Artigo Publicado,Passive vibration control using a metaconcrete thin plate,2019.0,,,,CERÂMICA,,,"Edson Jansen Pedrosa de Miranda Júnior (Miranda Jr., E. J. P.), ANGELIN, A.F. (ANGELIN, A.F.), Fabiana Maria da Silva (SILVA, F. M.), DOS SANTOS, J.M.C. (DOS SANTOS, J.M.C.)"
9782653543954493,30052024,Artigo Publicado,The use of tire rubber in the production of high-performance concrete,2019.0,,,,CERÂMICA,,,"Fabiana Maria da Silva (SILVA, F. M.), Edson Jansen Pedrosa de Miranda Júnior (Miranda Jr., E. J. P.), DOS SANTOS, J.M.C. (DOS SANTOS, J.M.C.), GACHET-BARBOSA, L.A. (GACHET-BARBOSA, L.A.), A. E. Gomes (GOMES, A. E.), LINTZ, R.C.C. (LINTZ, R.C.C.)"
9782653543954493,30052024,Artigo Publicado,Band Structure in a Sustainable Sonic Crystal,2019.0,,,,MATERIALS SCIENCE FORUM (ONLINE),,,"Edson Jansen Pedrosa de Miranda Júnior (MIRANDA JR., EDSON JANSEN PEDROSA), RODRIGUES, S.F. (RODRIGUES, S.F.), DOS SANTOS, J.M.C. (DOS SANTOS, J.M.C.)"
9782653543954493,30052024,Artigo Publicado,Influence of Spheroid and Fiber-Like Waste-Tire Rubbers on the Sound Absorption Coefficient of Rubberized Mortars,2019.0,,,,MATERIALS SCIENCE FORUM (ONLINE),,,"Edson Jansen Pedrosa de Miranda Júnior (MIRANDA JR., EDSON JANSEN PEDROSA), ANGELIN, ANDRESSA FERNANDA (ANGELIN, ANDRESSA FERNANDA), RODRIGUES, S.F. (RODRIGUES, S.F.), GACHET-BARBOSA, LUÍSA ANDRÉIA (GACHET-BARBOSA, LUÍSA ANDRÉIA), DOS SANTOS, J.M.C. (DOS SANTOS, J.M.C.)"
9782653543954493,30052024,Artigo Publicado,Strain-Induced Ferrite Formation During Steckel Mill Simulations with Varying Roughing Pass Schedules,2019.0,,,,Metals,,,"PALHANO, HENRY B. (PALHANO, HENRY B.), ARANAS, CLODUALDO (ARANAS, CLODUALDO), RODRIGUES, SAMUEL F. (RODRIGUES, SAMUEL F.), SILVA, EDEN S. (SILVA, EDEN S.), REIS, GEDEON S. (REIS, GEDEON S.), Edson Jansen Pedrosa de Miranda Júnior (MIRANDA, EDSON JANSEN P.), SICILIANO, FULVIO (SICILIANO, FULVIO), JONAS, JOHN J. (JONAS, JOHN J.)"
9782653543954493,30052024,Artigo Publicado,Flexural wave band gaps in multi-resonator elastic metamaterial Timoshenko beams,2019.0,,,,WAVE MOTION,,,"Edson Jansen Pedrosa de Miranda Júnior (MIRANDA, E.J.P.), DOS SANTOS, J.M.C. (DOS SANTOS, J.M.C.)"
9782653543954493,30052024,Artigo Publicado,Computing the complex wave and dynamic behavior of one-dimensional phononic systems using a state-space formulation,2019.0,,,,INTERNATIONAL JOURNAL OF MECHANICAL SCIENCES,,,"ASSIS, GEORGE F.C.A. (ASSIS, GEORGE F.C.A.), BELI, DANILO (BELI, DANILO), Edson Jansen Pedrosa de Miranda Júnior (MIRANDA, EDSON J.P. DE), CAMINO, JUAN F. (CAMINO, JUAN F.), SANTOS, JOSÉ MARIA C. DOS (SANTOS, JOSÉ MARIA C. DOS), ARRUDA, JOSÉ ROBERTO F. (ARRUDA, JOSÉ ROBERTO F.)"
9782653543954493,30052024,Artigo Publicado,Delay in the static softening kinetics of a Nb-N-bearing austenitic stainless steel,2019.0,,,,Materials Research Express,,,"LEITÃO FILHO, SEBASTIÃO R J B (LEITÃO FILHO, SEBASTIÃO R J B), SILVA, EDEN SANTOS (SILVA, EDEN SANTOS), RODRIGUES, SAMUEL F. (RODRIGUES, SAMUEL F.), ARANAS JR., CLODUALDO (ARANAS JR., CLODUALDO), Edson Jansen Pedrosa de Miranda Júnior (MIRANDA JR., EDSON JANSEN P), REIS, GEDEON SILVA (REIS, GEDEON SILVA), BALANCIN, OSCAR (BALANCIN, OSCAR)"
9782653543954493,30052024,Artigo Publicado,Modelling Propagating Bloch Waves in Magnetoelectroelastic Phononic Structures with Kagomé Lattice Using the Improved Plane Wave Expansion,2020.0,,,,Crystals,,,"Edson Jansen Pedrosa de Miranda Júnior (MIRANDA, EDSON JANSEN PEDROSA DE), RODRIGUES, SAMUEL FILGUEIRAS (RODRIGUES, SAMUEL FILGUEIRAS), ARANAS, CLODUALDO (ARANAS, CLODUALDO), SILVA, HÉLIO VITOR CANTANHÊDE DA (SILVA, HÉLIO VITOR CANTANHÊDE DA), SILVA, EDEN SANTOS (SILVA, EDEN SANTOS), REIS, GEDEON SILVA (REIS, GEDEON SILVA), PAIVA, ANTÔNIO ERNANDES MACEDO (PAIVA, ANTÔNIO ERNANDES MACEDO), dos Santos, José Maria Campos (dos Santos, José Maria Campos)"
9782653543954493,30052024,Artigo Publicado,"Wave attenuation in elastic metamaterial thick plates: Analytical, numerical and experimental investigations",2020.0,,,,INTERNATIONAL JOURNAL OF SOLIDS AND STRUCTURES,,,"Edson Jansen Pedrosa de Miranda Júnior (MIRANDA JR., E.J.P.), NOBREGA, E.D. (NOBREGA, E.D.), RODRIGUES, S.F. (RODRIGUES, S.F.), ARANAS JR., C. (ARANAS JR., C.), DOS SANTOS, J.M.C. (DOS SANTOS, J.M.C.)"
9782653543954493,30052024,Artigo Publicado,Retransformation of dynamically induced ferrite during physical simulation of Steckel mill hot rolling,2020.0,,,,Journal of Materials Research and Technology-JMR&T,,,"CARNEIRO, THIAGO BRUNO (CARNEIRO, THIAGO BRUNO), JONAS, JOHN JOSEPH (JONAS, JOHN JOSEPH), RODRIGUES, SAMUEL FILGUEIRAS (RODRIGUES, SAMUEL FILGUEIRAS), ARANAS, CLODUALDO (ARANAS, CLODUALDO), SICILIANO, FULVIO (SICILIANO, FULVIO), SILVA, EDEN SANTOS (SILVA, EDEN SANTOS), REIS, GEDEON SILVA (REIS, GEDEON SILVA), Edson Jansen Pedrosa de Miranda Júnior (MIRANDA, EDSON JANSEN PEDROSA), LEAL, VALDEMAR SILVA (LEAL, VALDEMAR SILVA), JAHAZI, MOHAMMAD (JAHAZI, MOHAMMAD)"
9782653543954493,30052024,Artigo Publicado,Elastic Wave Propagation in a Bio-Inspired Phononic Crystal,2020.0,,,,MATERIALS SCIENCE FORUM (ONLINE),,,"CANTANHÊDE, H.V. (CANTANHÊDE, H.V.), Edson Jansen Pedrosa de Miranda Júnior (MIRANDA JR., E.J.P.), DOS SANTOS, J.M.C. (DOS SANTOS, J.M.C.)"
9782653543954493,30052024,Artigo Publicado,Thermomechanical and thermodynamic behavior of deformed austenite in four different steel grades,2021.0,,,,Journal of Materials Research and Technology-JMR&T,,,"ARANAS, CLODUALDO (ARANAS, CLODUALDO), SICILIANO, FULVIO (SICILIANO, FULVIO), RODRIGUES, SAMUEL FILGUEIRAS (RODRIGUES, SAMUEL FILGUEIRAS), PASCO, JUBERT (PASCO, JUBERT), Edson Jansen Pedrosa de Miranda Júnior (MIRANDA, EDSON J.P.), JONAS, JOHN JOSEPH (JONAS, JOHN JOSEPH)"
9782653543954493,30052024,Artigo Publicado,Dispersion Diagram of Trigonal Piezoelectric Phononic Structures with Langasite Inclusions,2021.0,,,,Crystals,,,"Edson Jansen Pedrosa de Miranda Júnior (MIRANDA, EDSON), ARANAS, CLODUALDO (ARANAS, CLODUALDO), RODRIGUES, SAMUEL (RODRIGUES, SAMUEL), SILVA, HÉLIO (SILVA, HÉLIO), REIS, GEDEON (REIS, GEDEON), PAIVA, ANTÔNIO (PAIVA, ANTÔNIO), DOS SANTOS, JOSÉ (DOS SANTOS, JOSÉ)"
9782653543954493,30052024,Artigo Publicado,Physical Simulation Based on Dynamic Transformation Under Hot Plate Rolling of a Nb-Microalloyed Steel,2021.0,,,,FRONTIERS IN MATERIALS,,,"FERREIRA, JOÃO CARLOS (FERREIRA, JOÃO CARLOS), DE SOUSA MACHADO, FRANCISCO ROMARIO (DE SOUSA MACHADO, FRANCISCO ROMARIO), ARANAS, CLODUALDO (ARANAS, CLODUALDO), SICILIANO, FULVIO (SICILIANO, FULVIO), PASCO, JUBERT (PASCO, JUBERT), REIS, GEDEON SILVA (REIS, GEDEON SILVA), Edson Jansen Pedrosa de Miranda Júnior (PEDROSA DE MIRANDA, EDSON JANSEN), MACÊDO PAIVA, ANTÔNIO ERNANDES (MACÊDO PAIVA, ANTÔNIO ERNANDES), RODRIGUES, SAMUEL FILGUEIRAS (RODRIGUES, SAMUEL FILGUEIRAS)"
9782653543954493,30052024,Artigo Publicado,Elastic wave propagation in metamaterial rods with periodic shunted piezo-patches,2021.0,,,,INTER-NOISE and NOISE-CON Congress and Conference Proceedings,,,"Edson Jansen Pedrosa de Miranda Júnior (MIRANDA, EDSON J.P. DE), NOBREGA, EDILSON D. (NOBREGA, EDILSON D.), OLIVEIRA, LEOPOLDO P.R. DE (OLIVEIRA, LEOPOLDO P.R. DE), DOS SANTOS, JOSÉ M.C. (DOS SANTOS, JOSÉ M.C.)"
9782653543954493,30052024,Artigo Publicado,Wave attenuation in 1-3 phononic structures with lead-free piezoelectric ceramic inclusions,2022.0,,,,PHYSICA B-CONDENSED MATTER,,,"Edson Jansen Pedrosa de Miranda Júnior (MIRANDA, E.J.P.), DOS SANTOS, J.M.C. (DOS SANTOS, J.M.C.)"
9782653543954493,30052024,Artigo Publicado,Complex dispersion diagram and evanescent modes in piezomagnetic phononic structures,2022.0,,,,SOLID STATE COMMUNICATIONS,,,"Edson Jansen Pedrosa de Miranda Júnior (MIRANDA, E.J.P.), RODRIGUES, S.F. (RODRIGUES, S.F.), DOS SANTOS, J.M.C. (DOS SANTOS, J.M.C.)"
9782653543954493,30052024,Artigo Publicado,Plane wave expansion and extended plane wave expansion formulations for Mindlin-Reissner elastic metamaterial thick plates,2022.0,,,,JOURNAL OF MATHEMATICAL ANALYSIS AND APPLICATIONS,,,"Edson Jansen Pedrosa de Miranda Júnior (MIRANDA, E.J.P.), RODRIGUES, S.F. (RODRIGUES, S.F.), ARANAS, C. (ARANAS, C.), DOS SANTOS, J.M.C. (DOS SANTOS, J.M.C.)"
9782653543954493,30052024,Artigo Publicado,Wave attenuation in viscoelastic hierarchical plates,2022.0,,,,INTERNATIONAL JOURNAL OF MECHANICAL SCIENCES,,,"DAL POGGETTO, VINÍCIUS F. (DAL POGGETTO, VINÍCIUS F.), Edson Jansen Pedrosa de Miranda Júnior (JR., EDSON J.P. MIRANDA), DOS SANTOS, JOSÉ MARIA C. (DOS SANTOS, JOSÉ MARIA C.), PUGNO, NICOLA M. (PUGNO, NICOLA M.)"
9782653543954493,30052024,Artigo Publicado,Acoustic and Thermal Analyses of Self-Consolidating Lightweight Rubberized Concretes,2022.0,,,,ACI MATERIALS JOURNAL,,,"ANGELIN, ANDRESSA FERNANDA (ANGELIN, ANDRESSA FERNANDA), Edson Jansen Pedrosa de Miranda Júnior (DE MIRANDA JUNIOR, EDSON JANSEN PEDROSA), dos Santos, José Maria Campos (dos Santos, José Maria Campos), OSÓRIO, WISLEI RIUPER (OSÓRIO, WISLEI RIUPER), CECCHE LINTZ, ROSA CRISTINA (CECCHE LINTZ, ROSA CRISTINA), GACHET, LUÍSA ANDREIA (GACHET, LUÍSA ANDREIA)"
9782653543954493,30052024,Artigo Publicado,Extended plane wave expansion formulation for 1-D viscoelastic phononic crystals,2023.0,,,,Partial Differential Equations in Applied Mathematics,,,"Lucas Franco Correa Schalcher (SCHALCHER, L. F. C.), DOS SANTOS, J.M.C. (DOS SANTOS, J.M.C.), Edson Jansen Pedrosa de Miranda Júnior (Miranda Jr., E. J. P.)"
9782653543954493,30052024,Artigo Publicado,Wave Attenuation in 1-D Viscoelastic Phononic Crystal Rods Using Different Polymers,2023.0,,,,MATERIALS RESEARCH,,,"VINÍCIUS BRAGA SANTOS DE OLIVEIRA (OLIVEIRA, V. B. S.), Lucas Franco Correa Schalcher (SCHALCHER, L. F. C.), José Maria Campos dos Santos (DOS SANTOS, J. M. C.), Edson Jansen Pedrosa de Miranda Júnior (Miranda Jr., E. J. P.)"
9782653543954493,30052024,Artigo Publicado,Extended plane wave expansion formulation for viscoelastic phononic thin plates,2023.0,,,,WAVE MOTION,,,"Edson Jansen Pedrosa de Miranda Júnior (Miranda Jr., E. J. P.), DAL POGGETTO, VINÍCIUS F. (DAL POGGETTO, VINÍCIUS F.), PUGNO, NICOLA M. (PUGNO, NICOLA M.), DOS SANTOS, J.M.C. (DOS SANTOS, J.M.C.)"
9782653543954493,30052024,Artigo Publicado,Effect of Resonant Aggregate Parameters in Metaconcrete Thin Plates on Flexural Bandgaps: Numerical Simulations,2023.0,,,,Materials Research-Ibero-american Journal of Materials,,,"André Luiz Louzeiro Carvalho (CARVALHO, A. L. L.), Cássio Bruno Florêncio Gomes (GOMES, C. B. F.), José Maria Campos dos Santos (DOS SANTOS, J. M. C.), Edson Jansen Pedrosa de Miranda Júnior (Miranda Jr., E. J. P.)"
9782653543954493,30052024,Artigo Publicado,Wave attenuation in 1-D viscoelastic periodic structures with thermal effects,2024.0,,,,Journal of the Brazilian Society of Mechanical Sciences and Engineering,,,"VINÍCIUS BRAGA SANTOS DE OLIVEIRA (OLIVEIRA, V. B. S.), Cimark Guimarães Sandes Filho (SANDES FILHO, C. G.), José Maria Campos dos Santos (DOS SANTOS, J. M. C.), Edson Jansen Pedrosa de Miranda Júnior (Miranda Jr., E. J. P.)"
9782653543954493,30052024,Artigo Publicado,Silver-Doped Zirconia Nanoparticles as Possible Bactericide in Water Filters,2014.0,,,,Materials Science Forum (Online),,,"RODRIGUES, ERMERSON NEY LEITE (RODRIGUES, ERMERSON NEY LEITE), Edson Jansen Pedrosa de Miranda Júnior (MIRANDA, E.J.P.), OLIVEIRA, M.M. (OLIVEIRA, M.M.)"
2495541083851823,6052024,Artigo Publicado,HETEROTOPIAS: superfícies da formação do ator,2018.0,,,,IAÇÁ: Artes da Cena,,,"Gilberto dos Santos Martins (MARTINS, GILBERTO DOS SANTOS)"
2495541083851823,6052024,Artigo Publicado,Contextos e proposições: um panorama dos desejos de criação de uma escola de teatro nacional nos séculos XIX e XX,2018.0,,,,OUVIROUVER (ONLINE),,,"Gilberto dos Santos Martins (MARTINS, GILBERTO DOS SANTOS)"
2495541083851823,6052024,Artigo Publicado,Cruzamentos estéticos e políticos na cena teatral maranhense: olhares preliminares sobre Tempo de Espera de Aldo Leite (1975-1978),2018.0,,,,Meória ABRACE,,,"Gilberto dos Santos Martins (MARTINS, G. S.)"
2495541083851823,6052024,Artigo Publicado,O teatro engajado de Aldo Leite ou ouvindo mais pelos olhos do que  pelos ouvidos,2020.0,,,,REVISTA SENTIDOS DA CULTURA,,,"Gilberto dos Santos Martins (MARTINS, G. S.), José Denis de Oliveira Bezerra (BEZERRA, J. D. O.)"
2495541083851823,6052024,Artigo Publicado,"ENTREVISTA COM LUIZ PAZZINI: Memória, experiência e dialética na formação do ator.",2022.0,,,,RASCUNHOS - CAMINHOS DA PESQUISA EM ARTES CÊNICAS,,,"Gilberto dos Santos Martins (MARTINS, GILBERTO DOS SANTOS)"
2495541083851823,6052024,Artigo Publicado,Atrizes no teatro amador de São Luís na primeira metade do século XX,2022.0,,,,Urdimento-Revista De Estudos Em Artes Cenicas,,,"Gilberto dos Santos Martins (MARTINS, GILBERTO), MARTINS, BENEDITA AFONSO (MARTINS, BENEDITA AFONSO)"
2495541083851823,6052024,Artigo Publicado,Escolas de Teatro: dialéticas sobre a formação do ator,2016.0,,,,OUVIROUVER (ONLINE),,,"Gilberto dos Santos Martins (MARTINS, GILBERTO DOS SANTOS)"
9373422431939982,28022023,Artigo Publicado,Análise da aplicação dos PCN na área de Teatro em escolas do município de São Luís-MA,2004.0,,,,Anais da 56ª SBPC,,,"Jacqueline Silva Mendes (MENDES, J. S.;MENDES, JACQUELINE SILVA;Mendes, Jacqueline S.)"
9373422431939982,28022023,Artigo Publicado,PCN em foco: realidade e possibilidades do Teatro no cotidiano escolar - um estudo de caso,2004.0,,,,PCN em foco: realidades e possibilidades do Teatro no cotidiano escolar (monografia),,,"Jacqueline Silva Mendes (MENDES, J. S.;MENDES, JACQUELINE SILVA;Mendes, Jacqueline S.)"
9373422431939982,28022023,Artigo Publicado,Mapeamento do ensino do Teatro em São Luís - MA e materialização dos PCN,2003.0,,,,Anais do XV Seminário de Iniciação Científica - UFMA,,,"Jacqueline Silva Mendes (MENDES, J. S.;MENDES, JACQUELINE SILVA;Mendes, Jacqueline S.)"
9373422431939982,28022023,Artigo Publicado,Mapeamento do ensino de Teatro em São Luís-MA e materialização dos PCN,2003.0,,,,Visões da Ilha: apontamentos sobre teatro e educação,,,"Jacqueline Silva Mendes (MENDES, J. S.;MENDES, JACQUELINE SILVA;Mendes, Jacqueline S.)"
9373422431939982,28022023,Artigo Publicado,Marcas e perspectivas do Teatro em São Luís,2003.0,,,,Anais do III Congresso da ABRACE (Associação Brasileira de pós-graduação em Artes Cênicas),,,"Jacqueline Silva Mendes (MENDES, J. S.;MENDES, JACQUELINE SILVA;Mendes, Jacqueline S.)"
9373422431939982,28022023,Artigo Publicado,5ª de Arte: importância e necessidade para os alunos e apreciadores do curso de Artes,2002.0,,,,Anais do III Encontro Humanístico - UFMA,,,"Jacqueline Silva Mendes (MENDES, J. S.;MENDES, JACQUELINE SILVA;Mendes, Jacqueline S.)"
9373422431939982,28022023,Artigo Publicado,Teatro Ludovicense no século XIX: uma análise do teatro através de jornais maranhenses de 1880 a 1890,2012.0,,,,Revista aSPAs,,,"Jacqueline Silva Mendes (MENDES, JACQUELINE SILVA)"
9373422431939982,28022023,Artigo Publicado,O design em um diário de campo: viajando entre histórias de Itamatatiua com destino à educação quilombola,2023.0,,,,Revista Arcos Design,,,"Glauba Alves do Vale Cestari (CESTARI, G.A.V.), Luiz Fernando Gonçalves de Figueiredo (FIGUEIREDO, L. F. G.), Nayara Chaves Ferreira Perpetuo (PERPETUO, N. C. F.), Jacqueline Silva Mendes (Mendes, Jacqueline S.)"
9373422431939982,28022023,Artigo Publicado,Formação de professores em Arte: análise da disciplina desenvolvida no Ensino Fundamental do município de Palmeirândia-MA,2005.0,,,,Anais da 57ª SBPC,,,"Jacqueline Silva Mendes (MENDES, J. S.;MENDES, JACQUELINE SILVA;Mendes, Jacqueline S.)"
7264632420393292,4042024,Artigo Publicado,A Fuzzy Inference System for Increasing of Survivability and Efficiency in Wireless Sensor Networks,2013.0,,,,JOURNAL OF COMMUNICATION AND COMPUTER,,,"Rodrigo A. Sousa Baluz (BALUZ, R. A. S.), Raimir Holanda Filho (HOLANDA FILHO, R.), José Victor Vasconcelos Sobral (SOBRAL, J. V. V.), Aldir Da Silva Sousa (SOUSA, A. S.), Harilton da S. Araujo (ARAUJO, H. S.), Marcus Vinicius de Sousa Lemos (LEMOS, M. V. S.), Ricardo de Andrade Lira Rabêlo (RABELO, R. A. L.)"
7264632420393292,4042024,Artigo Publicado,Performance Evaluation of Routing Metrics in the LOADng Routing Protocol,2017.0,,,,JCOMSS - Journal of Communications Software and Systems,,,"José Victor Vasconcelos Sobral (SOBRAL, JOSE V. V.), RODRIGUES, JOEL J. P. C. (RODRIGUES, JOEL J. P. C.), KUMAR, NEERAJ (KUMAR, NEERAJ), ZHU, CHUNSHENG (ZHU, CHUNSHENG), AHMAD, RAJA W. (AHMAD, RAJA W.)"
7264632420393292,4042024,Artigo Publicado,A Proposal for IoT Dynamic Routes Selection Based on Contextual Information,2018.0,,,,SENSORS,,,"ARAÚJO, HARILTON (ARAÚJO, HARILTON), FILHO, RAIMIR (FILHO, RAIMIR), RODRIGUES, JOEL (RODRIGUES, JOEL), RABELO, RICARDO (RABELO, RICARDO), SOUSA, NATANAEL (SOUSA, NATANAEL), FILHO, JOSÉ (FILHO, JOSÉ), José Victor Vasconcelos Sobral (SOBRAL, JOSÉ)"
7264632420393292,4042024,Artigo Publicado,A framework for enhancing the performance of Internet of Things applications based on RFID and WSNs,2018.0,,,,JOURNAL OF NETWORK AND COMPUTER APPLICATIONS,,,"José Victor Vasconcelos Sobral (SOBRAL, JOSÉ V.V.), RODRIGUES, JOEL J.P.C. (RODRIGUES, JOEL J.P.C.), RABELO, RICARDO A.L. (RABELO, RICARDO A.L.), LIMA FILHO, JOSÉ C. (LIMA FILHO, JOSÉ C.), SOUSA, NATANAEL (SOUSA, NATANAEL), ARAUJO, HARILTON S. (ARAUJO, HARILTON S.), HOLANDA FILHO, RAIMIR (HOLANDA FILHO, RAIMIR)"
7264632420393292,4042024,Artigo Publicado,Identificação de assinaturas de carga de eletrodomésticos residenciais em Smart Meters usando Inteligência Artificial e IoT: Implementação e testbed,2018.0,,,,REVISTA DE INFORMÁTICA APLICADA,,,"Thiago C. Sousa (SOUSA, T. C.), Artur Felipe da Silva Veloso (VELOSO, A. F. S.), Regenildo G. Oliveira (OLIVEIRA, R. G.), Antonio A Rodrigues (RODRIGUES, A. A.), Davi L. Oliveira (OLIVEIRA, D. L.), Altamir J Gallas (GALLAS, A. J.), José Victor Vasconcelos Sobral (SOBRAL, JOSÉ V. V.)"
7264632420393292,4042024,Artigo Publicado,LOADng-IoT: An Enhanced Routing Protocol for Internet of Things Applications over Low Power Networks,2019.0,,,,SENSORS,,,"José Victor Vasconcelos Sobral (SOBRAL, JOSÉ), RODRIGUES, JOEL (RODRIGUES, JOEL), RABELO, RICARDO (RABELO, RICARDO), SALEEM, KASHIF (SALEEM, KASHIF), FURTADO, VASCO (FURTADO, VASCO)"
7264632420393292,4042024,Artigo Publicado,Routing Protocols for Low Power and Lossy Networks in Internet of Things Applications,2019.0,,,,SENSORS,,,"José Victor Vasconcelos Sobral (SOBRAL, JOSÉ V. V.), RODRIGUES, JOEL J. P. C. (RODRIGUES, JOEL J. P. C.), RABÊLO, RICARDO A. L. (RABÊLO, RICARDO A. L.), AL-MUHTADI, JALAL (AL-MUHTADI, JALAL), KOROTAEV, VALERY (KOROTAEV, VALERY)"
7264632420393292,4042024,Artigo Publicado,Multicast Improvement for LOADng in Internet of Things Networks,2019.0,,,,MEASUREMENT,,,"José Victor Vasconcelos Sobral (SOBRAL, JOSÉ V.V.), RODRIGUES, JOEL J.P.C. (RODRIGUES, JOEL J.P.C.), RABÊLO, RICARDO L. (RABÊLO, RICARDO L.), AL-MUHTADI, JALAL (AL-MUHTADI, JALAL)"
7264632420393292,4042024,Artigo Publicado,Improving the Performance of LOADng Routing Protocol in Mobile IoT Scenarios,2019.0,,,,IEEE Access,,,"José Victor Vasconcelos Sobral (SOBRAL, JOSE V. V.), RODRIGUES, JOEL J. P. C. (RODRIGUES, JOEL J. P. C.), RABELO, RICARDO A. L. (RABELO, RICARDO A. L.), SALEEM, KASHIF (SALEEM, KASHIF), KOZLOV, SERGEI (KOZLOV, SERGEI)"
