numero_identificador,data_atualizacao,tipo,titulo,ano,pais,evento,cidade,periodico,editora,descricao,autores
2992915467192808,30052024,Artigo Publicado,Educação Popular na Atenção Básica: um enfoque na integralidade,2015.0,,,,REVISTA GESTÃO & SAÚDE (BRASÍLIA),,,"Ana Regina Leão Ibiapina Moura (IBIAPINA, A. R. L.), Ana Lídia Lima Freire (FREIRE, A. L. L.), Camila do Vale Matos (MATOS, C. V.), Nayara Holanda Vieira (VIEIRA, N. H.), Paula Indira Nunes Carvalho (CARVALHO, P. I. N.), Thaís Norberta Bezerra de Moura (MOURA, T. N. B.)"
2992915467192808,30052024,Artigo Publicado,Caracterização dos usuários e do padrão de uso das academias ao ar livre,2017.0,,,,REVISTA BRASILEIRA EM PROMOÇÃO DA SAÚDE (ONLINE),,,"Ana Regina Leão Ibiapina Moura (REGINA LEÃO IBIAPINA, ANA), DO NASCIMENTO MOURA, MAYCOM (DO NASCIMENTO MOURA, MAYCOM), LUCI ESTEVES SANTIAGO, MARIA (LUCI ESTEVES SANTIAGO, MARIA), NORBERTA BEZERRA DE MOURA, THAIS (NORBERTA BEZERRA DE MOURA, THAIS)"
2992915467192808,30052024,Artigo Publicado,ACADEMIAS AO AR LIVRE: PERCEPÇÕES DOS USUÁRIOS E RELAÇÃO COM O SERVIÇO DE SAÚDE,2020.0,,,,Arquivos de Ciências da Saúde da UNIPAR,,,"Maycom do Nascimento Moura (MOURA, M. N.), Ana Regina Leão Ibiapina Moura (IBIAPINA, A. R. L.), Maria Luci Esteves Santiago (SANTIAGO, M. L. E.), Thaís Norberta Bezerra de Moura (MOURA, T. N. B.)"
2992915467192808,30052024,Artigo Publicado,"EDUCAÇÃO AMBIENTAL E CIDADANIA: REFLEXÕES ACERCA DO PROJETO ?PLANTE UMA ÁRVORE, PRESERVE O FUTURO!'",2018.0,,,,EDUCAÇÃO AMBIENTAL EM AÇÃO,,,"Ana Regina Leão Ibiapina Moura (IBIAPINA, A. R. L.), Adeval Alexandre Cavalcante Neto (CAVALCANTE NETO, A. A.)"
2992915467192808,30052024,Artigo Publicado,BARREIRAS PARA O TRANSPORTE ATIVO EM ESCOLARES,2020.0,,,,TEMAS EM EDUCAÇÃO FÍSICA ESCOLAR,,,"José Fernando Vila Nova de Moraes (MORAES, J. F. V. N.), FELIPE RAMON BATISTA BARROS (BARROS, F. R. B.), GABRIEL LUCAS MORAIS FREIRE (FREIRE, G. L. M.), Ana Regina Leão Ibiapina Moura (ANA REGINA LEÃO IBIAPINA MOURA), ANTÔNIO MARCOS ARAÚJO DA SILVA (SILVA, A. M. A.), JOSÉ ROBERTO ANDRADE DO NASCIMENTO JÚNIOR (NASCIMENTO JUNIOR, J. R. A.)"
2992915467192808,30052024,Artigo Publicado,Custo da Obesidade na Adolescência entre 2008 e 2018 a Partir dos Dados do Datasus,2020.0,,,,REVISTA CONTEXTO & SAÚDE,,,"Ana Regina Leão Ibiapina Moura (MOURA, A. R. L. I.), Andreia Aparecida Andrade de Santana (SANTANA, A. A. A.), Jaine Francielle Ribeiro de Alencar (ALENCAR, J. F. R.), Tuane Rodrigues de Carvalho (CARVALHO, T. R.), José Fernando Vila Nova de Moraes (MORAES, J. F. V. N.)"
2992915467192808,30052024,Artigo Publicado,Blood pressure responses to the Cold Pressor Test according to body mass index and waist-to-height ratio in adolescents,2020.0,,,,REVISTA CIÊNCIAS EM SAÚDE,,,"Francinete Deyse dos Santos (SANTOS, F. D.), Edna Ferreira Pinto (PINTO, E. F.), Ana Regina Leão Ibiapina Moura (MOURA, A. R. L. I.), Eguinaldo Vinícius de Carvalho Lima (LIMA, E. V. C.), Mariana Ferreira de Souza (SOUZA, M. F.), Ferdinando Oliveira Carvalho (CARVALHO, F. O.), José Fernando Vila Nova de Moraes (MORAES, J. F. V. N.)"
2992915467192808,30052024,Artigo Publicado,"Physical activity level, screen time and sleep duration according to sociodemographic data of students",2020.0,,,,Revista Saúde e Pesquisa,,,"Ana Regina Leão Ibiapina Moura (MOURA, A. R. L. I.), José Fernando Vila Nova de Moraes (MORAES, J. F. V. N.), Maycom Nascimento Moura (MOURA, M. N.), Ferdinando Oliveira Carvalho (CARVALHO, F. O.), Jorge Luiz de Brito Gomes (GOMES, J. L. B.)"
2992915467192808,30052024,Artigo Publicado,Idade em Ação: atividade física subsidiando a melhoria da adiposidade e aptidão cardiorespiratória de idosas treinadas,2014.0,,,,REVISTA GESTÃO & SAÚDE (BRASÍLIA),,,"Ana Regina Leão Ibiapina Moura (IBIAPINA, A. R. L.), Thaís Norberta Bezerra de Moura (MOURA, T. N. B.), Heloisa Maria Mendes de Melo Souza (SOUZA, H. M. M. M.), Renata Batista dos Santos Chaves (CHAVES, R. B. S.), Maria Luci Esteves Santiago (SANTIAGO, M. L. E.), Maycom Nascimento Moura (MOURA, M. N.)"
