numero_identificador,data_atualizacao,tipo,titulo,ano,pais,evento,cidade,periodico,editora,descricao,autores
9170200225511874,29042024,Trabalho em Evento,EXTRAÇÃO DE OLÉO ESSENCIAL EM FOLHAS DE Humiria balsamifera  (AUBL) PARA PRODUÇÃO DE SABONETES ARTESANAIS,2021,Brasil,SEMIC 2017-2018,São Luís,,,,"Jose Felipi Sousa Lima (LIMA, J. F. S.), Georgiana Eurides de Carvalho Marques (Marques, Georgiana Eurides de Carvalho), Marcos Bispo Pinheiro Camara2 (CAMARA, M. B. P.)"
9170200225511874,29042024,Trabalho em Evento,MORFOANATOMIA FOLIAR DE HUMIRIA BALSAMIFERA ENCONTRADA NA  REGIÃO DO BAIXO MUNIM - MA,2021,Brasil,SEMIC 2018-2019,São Luís,,,,"Deleildes Cristina dos Santos (SANTOS, D. C.), Georgiana Eurides de Carvalho Marques (Marques, Georgiana Eurides de Carvalho), Tatia Coelho Morais Lima (LIMA, T. C. M.)"
9170200225511874,29042024,Trabalho em Evento,"COMPOSTOS FENÓLICOS, CAROTENÓIDES E ATIVIDADE ANTIOXIDANTE DA  Hymenaea courbaril L.",2021,Brasil,SEMIC 2018-2019,São Luís,,,,"Jhuliana M Matos (MATOS, J. M.), Andressa, R, C, Costa (Costa, A. R. C), Georgiana Eurides de Carvalho Marques (Marques, Georgiana Eurides de Carvalho)"
9170200225511874,29042024,Trabalho em Evento,AVALIAÇÃO DO POTENCIAL DO FRUTO DO JATOBÁ (Hymenaea courbaril L.)  PARA CONTROLE BIOLÓGICO,2021,Brasil,SEMIC 2018-2019,São Luís,,,,"Camilla Bezerra Ferreira de Souza (SOUZA, C. B. F.), Georgiana Eurides de Carvalho Marques (Marques, Georgiana Eurides de Carvalho)"
9170200225511874,29042024,Trabalho em Evento,ESTUDO MORFOLOGICO E SENSORIAL DE PLANTAS MEDICINAIS  UTILIZADAS POR COMUNIDADES TRADICIONAIS NO MARANHÃO,2021,Brasil,SEMIC 2019-2020,São Luís,,,,"Micaelle Frota Gama (GAMA, M. F.), Georgiana Eurides de Carvalho Marques (Marques, Georgiana Eurides de Carvalho)"
9170200225511874,29042024,Trabalho em Evento,ANÁLISE FÍSICO- QUÍMICA DA Humiria balsamifera (AUBL) PARA FINS  MEDICINAIS,2021,Brasil,SEMIC 2019-2020,São Luís,,,,"Andressa Costa Leite Pinto (PINTO, A. C. L.), Georgiana Eurides de Carvalho Marques (Marques, Georgiana Eurides de Carvalho), Daniely Veronica Viana Cardoso (CARDOSO, D. V. V.), Flavia de Aquino Cutrim Farias (FARIAS, F. A. C.), Clenilma Marques Brandão (BRANDAO, C. M.)"
9170200225511874,29042024,Trabalho em Evento,CARACTERIZAÇÃO FÍSICO-QUÍMICA DA Hancornia Speciosa GOMES,2021,Brasil,SEMIC 2019-2020,São Luís,,,,"Flavia de Aquino Cutrim Farias (FARIAS, F. A. C.), MARIA EDUARDA COUTINHO DA SILVA (SILVA, M. E. C.), Bruno de Araujo Gomes (GOMES, B. A.), Daniely Veronica Viana Cardoso (CARDOSO, D. V. V.), Georgiana Eurides de Carvalho Marques (Marques, Georgiana Eurides de Carvalho), Helen Karine Araújo (ARAUJO, H. K.)"
9170200225511874,29042024,Trabalho em Evento,DETERMINAÇÃO DE COMPOSTOS BIOATIVOS DE HANCORNIA  SPECIOSA GOMES PARA FINS MEDICINAIS,2021,Brasil,SEMIC 2019-2020,São Luís,,,,"Clenilma Marques Brandão (BRANDAO, C. M.), Eshylley Braenne Santos Santos (SANTOS, E. B. S.), Georgiana Eurides de Carvalho Marques (Marques, Georgiana Eurides de Carvalho)"
9170200225511874,29042024,Trabalho em Evento,ELABORAÇAO DE C1OOKIES A BASE DE FARINHA DE JATOBÁ,2021,Brasil,SEMIC 2018-2019,São Luís,,,,"Laynna Sthephany Cordeiro Silva (SILVA, L. S. C.), Gabriel Martins Nepomuceno (NEPOMUCENO, G. M.), Georgiana Eurides de Carvalho Marques (De Carvalho Marques, Georgiana Eurides)"
9170200225511874,29042024,Trabalho em Evento,ESTUDO ETNOBOTÂNICO DAS PLANTAS MEDICINAIS UTILIZADAS  NAS COMUNIDADES TRADICIONAIS,2021,Brasil,SEMIC 2019-2020,São Luís,,,,"Ricardo Santos Avelar (AVELAR, R. S.), Georgiana Eurides de Carvalho Marques (Marques, Georgiana Eurides de Carvalho)"
9170200225511874,29042024,Trabalho em Evento,AVALIAÇÃO DA AÇÃO BIOLÓGICA DAS ESPÉCIES NATIVAS Dughetia  Furfuracea (A.St.-Hill) e Chrysobalanus icaco L,2021,Brasil,SEMIC 2019-2020,São Luís,,,,"Jhovanna Teixeira Reis (REIS, J. T.), Georgiana Eurides de Carvalho Marques (Marques, Georgiana Eurides de Carvalho)"
9170200225511874,29042024,Trabalho em Evento,COMPOSTOS BIOATIVOS E POTENCIAL ANTIOXIDANTE DA ESPÉCIE  Duguetia furfuracea (A.St.-Hil.) Saf,2021,Brasil,SEMIC 2019-2020,São Luís,,,,"Naiara José Launé Ferreira (FERREIRA, N. J. L.), Georgiana Eurides de Carvalho Marques (Marques, Georgiana Eurides de Carvalho)"
9170200225511874,29042024,Trabalho em Evento,PARÂMETROS FÍSICO-QUÍMICOS DE PLANTAS MEDICINAIS DAS  ÁREAS DE TRANSIÇÃO CERRADO-AMAZÔNIA MARANHENSE,2021,Brasil,SEMIC 2019-2020,São Luís,,,,"Suzana dos Anjos Paz (PAZ, S. A.), Georgiana Eurides de Carvalho Marques (Marques, Georgiana Eurides de Carvalho)"
9170200225511874,29042024,Trabalho em Evento,LOGÍSTICA REVERSA DE MATERIAIS ORGÂNICOS ATRAVÉS DA COMPOSTAGEM DOMÉSTICA,2022,Brasil,Congresso Nacional Muldiciplinar em Ciências,,,,,"Osmar Luis Vasconcelos (VASCONCELOS, O. L.), Laiza Carneiro Moraes (MORAES, L. C.), Georgiana Eurides de Carvalho Marques (Marques, Georgiana Eurides de Carvalho)"
9170200225511874,29042024,Trabalho em Evento,ANÁLISE ESTOMÁTICA DA MACRÓFITA AQUÁTICA PAPOULA D?ÁGUA EM CONTATO COM CHUMBO,2022,Brasil,Congresso Norte e Nordeste de Pesquisa e Inovação,Porto Velho,,,,"Quemuel Fernandes Lima Verde (VERDE, Q. F. L.), Eduardo da Silva Mcedo (MCEDO, E. S.), Georgiana Eurides de Carvalho Marques (Marques, Georgiana Eurides de Carvalho), Nazare do Socorro Lemos Silva Vasconcelos (VASCONCELOS, N. S. L. S.), Tatia Coelho Morais Lima (LIMA, T. C. M.), ngela Maria Ferreira de Medeiro (MEDEIRO, N. M. F.)"
9170200225511874,29042024,Trabalho em Evento,AGROECOLOGIA EM SÃO LUÍS: QUEM PODE CONTRIBUIR NA SOBERANIA ALIMENTAR DE NOSSA POPULAÇÃO?,2022,Brasil,UNIVERSO IFAM 2022,GRAJAÚ,,,,"Georgiana Eurides de Carvalho Marques (Marques, Georgiana Eurides de Carvalho), Djanira Rubim dos Santos (SANTOS, D. R.), Roberta Almeida Muniz (MUNIZ, R. A.), Rodrigo Dominici Silva (SILVA, R. D.), Priscilla Maria Ferreira Costa (COSTA, P. M. F.), Cristhian Brito Bezerra da Silva (SILVA, C. B. B.)"
9170200225511874,29042024,Trabalho em Evento,APLICAÇÃO DA MACRÓFITA HYDROCLEYS NYMPHOIDES COMO AGENTE DE PURIFICAÇÃO DE CORPOS HÍDRICOS CONTAMINADOS POR CHUMBO,2022,Brasil,UNIVERSO IFMA 2022,GRAJAÚ,,,,"Quemuel Fernandes Lima Verde (VERDE, Q. F. L.), Georgiana Eurides de Carvalho Marques (Marques, Georgiana Eurides de Carvalho), Tatia Coelho Morais Lima (LIMA, T. C. M.)"
9170200225511874,29042024,Trabalho em Evento,ETNOCONHECIMENTO ASSOCIADO AO USO DO LATEX DE JANAÚBA (HIMATANTHUS DRASTICUS (MART.) PLUMEL) E SEUS REFLEXOS NA COMERCIALIZAÇÃO DE SUAS FORMULAÇÕES FARMACOLÓGICAS,2022,Brasil,UNIVERSO IFMA 2022,GRAJAÚ,,,,"ALLYCIA MAYRA VIEGAS PEREIRA (PEREIRA, A. M. V.), Danielly Christinne Ferreira E Ferreira (FERREIRA, D. C. F. E.), RYAN OLIVEIRA ROCHA (ROCHA, R. O.), Georgiana Eurides de Carvalho Marques (Marques, Georgiana Eurides de Carvalho), Clenilma Marques Brandão (BRANDAO, C. M.)"
9170200225511874,29042024,Trabalho em Evento,POTENCIAL BIOATIVO DO LÁTEX DE JANAÚBA (HIMANTANTHUS DRASTICUS (MART.) PLUMEL) COMERCIALIZADO EM SÃO LUÍS - MA,2022,Brasil,UNIVERSO IFMA 2022,GRAJAÚ,,,,"Carlos Alberto de Sousa Reis (REIS, C. A. S.), Bruno de Araujo Gomes (GOMES, B. A.), Clenilma Marques Brandão (BRANDAO, C. M.), Djanira dos Santos Rubim (RUBIM, D. S.), Georgiana Eurides de Carvalho Marques (Marques, Georgiana Eurides de Carvalho)"
9170200225511874,29042024,Trabalho em Evento,TESTE DE ESTABILIDADE E SENSORIAL DA FORMULAÇÃO DE COSMÉTICOS ARTESANAIS À BASE DE JANAÚBA HIMATANTHUS DRASTICUS (MART.) PLUMEL,2023,Brasil,UNIVERSO IFMA @023,São Luís,,,,"Andressa Sousa da Silva (SILVA, A. S.), Ellen Cristine Nogueira Nojosa (NOJOSA, E. C. N.), Djanira Rubim Santos (SANTOS, D. R.), Clenilma Marques Brandão (BRANDAO, C. M.), Roberta Almeida Muniz (MUNIZ, R. A.), Georgiana Eurides de Carvalho Marques (Marques, Georgiana Eurides de Carvalho)"
9170200225511874,29042024,Trabalho em Evento,TESTE DE ESTABILIDADE E SENSORIAL EM FORMULAÇÃO DE COSMETICOS ARTESANAIS À BASE DE MANGABA,2023,Brasil,UNIVERSO IFMA 2023,São Luís,,,,"LUCIANA OLIVEIRA ROSENDO (ROSENDO, L. O.), Georgiana Eurides de Carvalho Marques (Marques, Georgiana Eurides de Carvalho)"
9170200225511874,29042024,Trabalho em Evento,DETERMINAÇÃO DE VITAMINA C EM PLANTAS NATIVAS DA REGIÃO DE TRANSIÇÃO CERRADO - AMAZÔNIA MARANHENSE,2023,Brasil,UNIVERSO IFMA 2023,São Luís,,,,"Cristhian Brito Bezerra da Silva (SILVA, C. B. B.), Georgiana Eurides de Carvalho Marques (Marques, Georgiana Eurides de Carvalho), Clenilma Marques Brandão (BRANDAO, C. M.), Djanira Rubim dos Santos (SANTOS, D. R.), Roberta Almeida Muniz (MUNIZ, R. A.), Ellen Cristine Nogueira Nojosa (NOJOSA, E. C. N.)"
9170200225511874,29042024,Trabalho em Evento,ATIVIDADE BIOLÓGICA DE EXTRATOS ALCOÓLICOS À BASE DE PLANTAS NATIVAS DO CERRADO MARANHENSE,2023,Brasil,UNIVERSO IFMA 2023,São Luís,,,,"Mauricio Manoel Ferreira Ribeiro (RIBEIRO, M. M. F.), Beatriz dos Santos Everton (EVERTON, B. S.), Georgiana Eurides de Carvalho Marques (Marques, Georgiana Eurides de Carvalho), Djanira Rubim dos Santos (SANTOS, D. R.), Clenilma Marques Brandão (BRANDAO, C. M.)"
9170200225511874,29042024,Trabalho em Evento,BIOPROSPECÇÃO À BASE DE EXTRATOS DO CAULE E FOLHAS DE ATTALEA MARIPA (AUBL.) MART,2023,Brasil,UNIVERSO IFMA 2023,São Luís,,,,"Iara Stefane Vasconcelos Martins (MARTINS, I. S. V.), Georgiana Eurides de Carvalho Marques (Marques, Georgiana Eurides de Carvalho), Clenilma Marques Brandão (BRANDAO, C. M.), Djanira Rubim dos Santos (SANTOS, D. R.), Roberta Almeida Muniz (MUNIZ, R. A.), Ellen Cristine Nogueira Nojosa (NOJOSA, E. C. N.)"
9170200225511874,29042024,Trabalho em Evento,HYDROCLEYS NYMPHOIDES COMO AGENTE BIOINDICADOR DE AMBIENTES CONTAMINADOS POR CÁDMIO E CHUMBO: UM ESTUDO COMPARATIVO,2023,Brasil,UNIVERSO IFMA 2023,São Luís,,,,"Tiago Carneiro Pereira (PEREIRA, T. C.), Georgiana Eurides de Carvalho Marques (Marques, Georgiana Eurides de Carvalho), Eduardo da Silva Mcedo (MCEDO, E. S.), Quemuel Fernandes Lima Verde (VERDE, Q. F. L.), Clenilma Marques Brandão (BRANDAO, C. M.), Djanira Rubim dos Santos (SANTOS, D. R.)"
9170200225511874,29042024,Trabalho em Evento,"DIFERENÇAS MORFOMÉTRICAS DE FRUTOS DAS PALMEIRAS NATIVAS DO MARANHÃO: ATTALEA SPECIOSA MART. EX SPRENG (BABAÇU), EUTERPE OLERACEAE MART. (JUÇARA), ATTALEA MARIPA (AUBL) MART (ANAJÁ), MAURITIA FLEXUOSA L. (BURITI)",2022,Brasil,"I Congresso Brasileiro Online de Ensino, Pesquisa e Extensão",on line,,,,"Georgiana Eurides de Carvalho Marques (Marques, Georgiana Eurides de Carvalho), ARAUJO, STTELA CRISTINA CARVALHO (ARAUJO, STTELA CRISTINA CARVALHO), GAMA, MICAELE FROTA (GAMA, MICAELE FROTA), MARQUES, JULIANE CUTRIM (MARQUES, JULIANE CUTRIM), CARVALHO, EDSON MAURO VIANA DE (CARVALHO, EDSON MAURO VIANA DE)"
9170200225511874,29042024,Artigo Publicado,"Aplicação de biossólidos na cultura do algodão (Gossypium hirsutum L.) variedade delta opal, em condiçções de casa de vegetação",2007,,,,Pesquisa em Foco,,,"Georgiana Eurides de Carvalho Marques (Marques, Georgiana Eurides de Carvalho), Eduardo Ferreira Rodrigues (RODRIGUES, Eduardo Ferreira), Francisco Solano Oliveira Rodrigues Filho (RODRIGUES FILHO, F. S. O.)"
9170200225511874,29042024,Artigo Publicado,Avaliação Biométrica de plantas de bacurizeiro (Platonia insignis Mart.) sob manejo de brotações jovens no Estado do Maranhao,2009,,,,Revista Brasileira de Agroecologia,,,"Georgiana Eurides de Carvalho Marques (Marques, Georgiana Eurides de Carvalho), Valdomiro Aurélio Barbosa de Souza (SOUZA, V. A. B.), Natália Nicole Furtado Costa (COSTA, N. N. F.), Auderes Watyson Oliveira Santos (SANTOS, A. W. O.), Rafael Rocha da Silva (SILVA, R. R.)"
9170200225511874,29042024,Artigo Publicado,Avaliação biométrica de plantas de açai (Euterpe Oleraceae) em um sistema agroflorestal na pré-amazonia maranhense,2009,,,,Revista Brasileira de Agroecologia,,,"Georgiana Eurides de Carvalho Marques (Marques, Georgiana Eurides de Carvalho), Edvaldo Sagrilo (SAGRILO, E.), Ernildo Cesar Serafim (SERAFIM, E. C.), Claudyanne do Nascimento Costa (COSTA, C. N.)"
9170200225511874,29042024,Artigo Publicado,Análise da relação homem-natureza em comunidades quilombolas no municipio de Alcântara,2011,,,,Cadernos de Agroecologia,,,"Georgiana Eurides de Carvalho Marques (Marques, Georgiana Eurides de Carvalho), Conceição de Maria Braga (BRAGA, C. M.), Denize Serejo França (FRANCA, D. S.)"
9170200225511874,29042024,Artigo Publicado,Caracterização agrícola de comunidades quilombolas no municipio de Alcantara - MA,2011,,,,Cadernos de Agroecologia,,,"Georgiana Eurides de Carvalho Marques (Marques, Georgiana Eurides de Carvalho), Conceição de Maria Braga (BRAGA, C. M.), Denize Serejo França (FRANCA, D. S.)"
9170200225511874,29042024,Artigo Publicado,"Analise de um processo de povoamento de colmeias de Melipona compressipes fasciculata Smith (Hymenoptera, Apidae).",2012,,,,Revista Brasileira de Agroecologia,,,"Georgiana Eurides de Carvalho Marques (Marques, Georgiana Eurides de Carvalho), Jose Mauricio Dias Bezerra (BEZERRA, J. M. D.)"
9170200225511874,29042024,Artigo Publicado,UM OLHAR SOBRE A REALIDADE ATUAL DOS REMANESCENTES DE QUILOMBOLAS NO MUNICIPIO DE ALCÂNTARA-MA,2012,,,,Acta Tecnologica,,,"Georgiana Eurides de Carvalho Marques (Marques, Georgiana Eurides de Carvalho), Conceição de Maria Braga (BRAGA, C. M.), Denize Serejo França (FRANCA, D. S.)"
9170200225511874,29042024,Artigo Publicado,ANÁLISE DE VARIEDADES CRIOULAS DE ARROZ (Oriza sativa L.) EM COMUNIDADES TRADICIONAIS NO ESTADO DO MARANHÃO,2015,,,,Enciclopédia Biosfera,,,"Georgiana Eurides de Carvalho Marques (Marques, Georgiana Eurides de Carvalho), Viviana do Carmos Loch (LOCH, V. C.), Bruna Rayana dos Santos Sampaio (SAMPAIO, B. R. S.), Jose Felipi Sousa Lima (LIMA, J. F. S.), Roberta Almeida Muniz (MUNIZ, R. A.)"
9170200225511874,29042024,Artigo Publicado,"Experiências de ensino, pesquisa e extensão do Núcleo de Estudos em Agroecologia ? Ifma/Campus Monte Castelo",2015,,,,Cadernos de Agroecologia,,,"Georgiana Eurides de Carvalho Marques (Marques, Georgiana Eurides de Carvalho), Vivian do Carmo Loch (LOCH, V. C.), Flora Thaynã Seixas de Jesus (JESUS, F. T. S.), Emerson Lucas Tomaz da Silva (SILVA, E. L. T.), Cidvania A de Oliveira (OLIVEIRA, Cidvania A de)"
9170200225511874,29042024,Artigo Publicado,Descrição morfométrica de sementes crioulas de milho (Zea mays) em comunidades tradicionais no Estado do Maranhão,2015,,,,Cadernos de Agroecologia,,,"Georgiana Eurides de Carvalho Marques (Marques, Georgiana Eurides de Carvalho), Marciel Nascimento Justino (JUSTINO, M. N.), Flora Thaynã Seixas de Jesus (JESUS, F. T. S.), Vivian do Carmo Loch (LOCH, V. C.), Cidvania A de Oliveira (OLIVEIRA, Cidvania A de)"
9170200225511874,29042024,Artigo Publicado,Nitrogen Use and Protein Yield of Two Maize Cultivars in Cohesive Tropical Soil,2017,,,,Journal of Agricultural Science,,,"Georgiana Eurides de Carvalho Marques (Marques, Georgiana Eurides Carvalho), AGUIAR, ALANA DAS CHAGAS FERREIRA (AGUIAR, ALANA DAS CHAGAS FERREIRA), MACEDO, VINICIUS RIBAMAR ALENCAR (MACEDO, VINICIUS RIBAMAR ALENCAR), ALVES, ESTER DE PAIVA (ALVES, ESTER DE PAIVA), MOURA, EMANOEL GOMES (MOURA, EMANOEL GOMES)"
9170200225511874,29042024,Artigo Publicado,Atuação do Núcleo de Estudos em Agroecologia doIFMA-Monte Castelona construção do debate do conhecimento agroecológico,2017,,,,Cadernos Agroecológicos,,,"Georgiana Eurides de Carvalho Marques (Marques, Georgiana Eurides de Carvalho), Roberta Almeida Muniz (MUNIZ, R. A.), Lucas Silva de Abreu (ABREU, L. S.), Clenilma Marques Brandão (BRANDAO, C. M.), Vivian do Carmo Loch (LOCH, V. C.)"
9170200225511874,29042024,Artigo Publicado,"PHYSICO-CHEMICAL PARAMETERS OF NATIVE FRUITS OF AMAZON, MARANHÃO, BRAZIL",2017,,,,INTERNATIONAL JOURNAL OF CURRENT RESEARCH,,,"Djanira Rubim dos Santos (SANTOS, D. R.), Georgiana Eurides de Carvalho Marques (Marques, Georgiana Eurides de Carvalho), Clenilma Marques Brandão (BRANDAO, C. M.), Adriano Souza Fonseca (FONSECA, A. S.), Marciel Nascimento Justino (JUSTINO, M. N.)"
9170200225511874,29042024,Artigo Publicado,"estudo de recursos genéticos vegetais para fins medicinais em áreas de transição no estado do Maranhão, Brasil",2017,,,,Revista de Biologia Neotropical,,,"Vivian do Carmo Loch (LOCH, V. C.), Georgiana Eurides de Carvalho Marques (Marques, Georgiana Eurides de Carvalho), Ariadne Enes Rocha (ROCHA, A. E.), Dayane Sampaio Barros Nascimento (NASCIMENTO, D. S. B.), Martha Cristina Conde de Almeida (ALMEIDA, Martha Cristina Conde de)"
9170200225511874,29042024,Artigo Publicado,"Vivências, saberes e experiências para a construção do conhecimento agroecológico",2018,,,,Revista Brasileira de Agroecologia (Online),,,"Georgiana Eurides de Carvalho Marques (Marques, Georgiana Eurides de Carvalho), Clenilma Marques Brandão (BRANDAO, C. M.), Roberta Almeida Muniz (MUNIZ, R. A.), Ariadne Enes Rocha (ROCHA, A. E.), Fábio Pierre Fontenele Pacheco (PACHECO, Fábio Pierre Fontenele)"
9170200225511874,29042024,Artigo Publicado,Effects of legume green manure on the physicochemical quality of maize grains (Zea mays L.),2018,,,,AUSTRALIAN JOURNAL OF CROP SCIENCE (ONLINE),,,"Georgiana Eurides de Carvalho Marques (Marques, Georgiana Eurides de Carvalho), Kaiany Sirley Brandão Cavalcante (CAVALCANTE, K. S. B.), Lanna Karine Silva (SILVA, L. K.), Natilene Mesquita Brito (BRITO, N. M.), Jose Felipi Sousa Lima (LIMA, J. F. S.), Emanoel Gomes de Moura (MOURA, E. G.)"
9170200225511874,29042024,Artigo Publicado,Jornadas Agroecológicas do Baixo Munim como Instrumento Pedagógico para Troca e Validação de Conhecimento entre Agricultores e Estudantes do Núcleo de Estudos em Agroecologia,2018,,,,Cadernos Agroecológicos,,,"Vivian do Carmo Loch (LOCH, V. C.), Georgiana Eurides de Carvalho Marques (Marques, Georgiana Eurides Carvalho), Ana Célia França Sousa (SOUSA, A. C. F.), Jose Felipi Sousa Lima (LIMA, J. F. S.), Marciel Nascimento Justino (JUSTINO, M. N.), Lucas Silva de Abreu (ABREU, L. S.)"
9170200225511874,29042024,Artigo Publicado,Casas de sementes: uma estratégia para conservação de sementes crioulas em assentamentos no estado do Maranhão,2018,,,,Cadernos Agroecológicos,,,"Georgiana Eurides de Carvalho Marques (Marques, Georgiana Eurides Carvalho), Andrey  L M Melo (MELO, A. L. M.), Juliane Cutrim Marques (MARQUES, J. C.), Clenilma Marques Brandão (BRANDAO, C. M.), Lucas Silva de Abreu (ABREU, L. S.)"
9170200225511874,29042024,Artigo Publicado,O uso de agrotóxicos pelos agricultores familiares em comunidades rurais de Paço do Lumiar - MA,2018,,,,Cadernos Agroecológicos,,,"Reinaldo Vinicius Morais Pereira (PEREIRA, R. V. M.), Georgiana Eurides de Carvalho Marques (Marques, Georgiana Eurides Carvalho), Lanna Karine Silva (SILVA, L. K.), Ellen Cristine Nogueira Nojosa (NOJOSA, E. C. N.)"
9170200225511874,29042024,Artigo Publicado,Qualidade química e fisiológica de sementes crioulas de arroz no Maranhão,2018,,,,Cadernos Agroecológicos,,,"Georgiana Eurides de Carvalho Marques (Marques, Georgiana Eurides Carvalho), Franciele Chaves Sousa (SOUSA, F. C.), Roberta Almeida Muniz (MUNIZ, R. A.), Lucas Silva de Abreu (ABREU, L. S.), Jhuliana M Matos (MATOS, J. M.)"
9170200225511874,29042024,Artigo Publicado,Uma Experiência com Beneficiamento de Frutos da Floresta na Região do Baixo Munim ? MA,2018,,,,Cadernos Agroecológicos,,,"Camila Nunes Santos Lima (CAMILA NUNES SANTOS LIMA,), Georgiana Eurides de Carvalho Marques (Marques, Georgiana Eurides Carvalho), Vivian do Carmo Loch (LOCH, V. C.), Roberta Almeida Muniz (MUNIZ, R. A.), Dayane Sampaio Barros Nascimento (NASCIMENTO, D. S. B.)"
9170200225511874,29042024,Artigo Publicado,BIOPROSPECTION OF MANGABA (HANCORNIA SPECIOSA Gomes) NATIVE IN THE TRANSITION REGION SAVANNA-RESTINGA,2020,,,,INTERNATIONAL JOURNAL OF DEVELOPMENT RESEARCH,,,"Georgiana Eurides de Carvalho Marques (Marques, Georgiana Eurides de Carvalho), Clenilma Marques Brandão (BRANDAO, C. M.), Djanira Rubim dos Santos (SANTOS, D. R.), Juliane Cutrim Marques (MARQUES, J. C.)"
9170200225511874,29042024,Artigo Publicado,A Extensão Universitária no Cenário Atual da Pandemia do COVID-19,2020,,,,REVISTA PRÁTICAS EM EXTENSÃO,,,"Georgiana Eurides de Carvalho Marques (Marques, Georgiana Eurides de Carvalho)"
9170200225511874,29042024,Artigo Publicado,"Ditos do Jatobá: desmatamento e falta de conservação de uma espécie nativa na visão de moradores da comunidade quilombola Damásio em Guimarães, Maranhão, Brasil",2020,,,,Cadernos Agroecológicos,,,"Ricardo Santos Avelar (AVELAR, R. S.), Georgiana Eurides de Carvalho Marques (Marques, Georgiana Eurides de Carvalho), Clenilma Marques Brandão (BRANDAO, C. M.)"
9170200225511874,29042024,Artigo Publicado,Formulação de Hidratante com Extratos de Humiria balsamifera (Aubl A. St. Hil) com Ação Antioxidante,2020,,,,Cadernos Agroecológicos,,,"Suzana dos Anjos Paz (PAZ, S. A.), Georgiana Eurides de Carvalho Marques (Marques, Georgiana Eurides de Carvalho)"
9170200225511874,29042024,Artigo Publicado,"Avaliação do perfil de consumidores e feirantes do Circuito de Feiras Agroecológicas do Baixo Munim, Maranhão, Brasil.",2020,,,,Cadernos Agroecológicos,,,"Reinaldo Vinicius Morais Pereira (PEREIRA, R. V. M.), Georgiana Eurides de Carvalho Marques (Marques, Georgiana Eurides de Carvalho), Ellen Cristine Nogueira Nojosa (NOJOSA, E. C. N.)"
9170200225511874,29042024,Artigo Publicado,Sabor e saber tradicional em cookies a base da farinha de Jatobá (Hymenaea courbaril L.),2020,,,,Cadernos Agroecológicos,,,"Gabryela Diniz Dias (Dias, G. D.), Georgiana Eurides de Carvalho Marques (Marques, Georgiana Eurides de Carvalho), Clenilma Marques Brandão (BRANDAO, C. M.)"
9170200225511874,29042024,Artigo Publicado,Juventude e Agroecologia: Uma experiência de formação em educação agroecológica para jovens agricultores do Meio-Norte do Brasil,2020,,,,Cadernos Agroecológicos,,,"Camila Nunes Santos Lima (CAMILA NUNES SANTOS LIMA,), Alice Maria Pinto Pinheiro (PINHEIRO, A. M. P.), warmiston carvalho (CARVALHO, W.), Georgiana Eurides de Carvalho Marques (Marques, Georgiana Eurides de Carvalho), Roberta Almeida Muniz (MUNIZ, R. A.), Vivian do Carmo Loch (LOCH, V. C.)"
9170200225511874,29042024,Artigo Publicado,"Composition and Larvicidal Activity of the Oil of Dizygostemon riparius</i> (Plantaginaceae), a New Aromatic Species Occurring in Maranhão, Brazil",2020,,,,CHEMISTRY & BIODIVERSITY,,,"BRANDÃO, CLENILMA M. (BRANDÃO, CLENILMA M.), CAVALCANTE, KIANY SIRLEY B. (CAVALCANTE, KIANY SIRLEY B.), M. TELES, ROGÉRIO (M. TELES, ROGÉRIO), Georgiana Eurides de Carvalho Marques (C. MARQUES, GEORGIANA E.), MONTEIRO, ODAIR S. (MONTEIRO, ODAIR S.), ANDRADE, ELOISA HELENA A. (ANDRADE, ELOISA HELENA A.), MAIA, JOSÉ GUILHERME S. (MAIA, JOSÉ GUILHERME S.)"
9170200225511874,29042024,Artigo Publicado,ALIMENTAÇÃO SAUDÁVEL: Integração da escola para a promoção da alimentação alternativa em uma escola pública de São Luís - MA,2021,,,,ACTA TECNOLÓGICA,,,"Georgiana Eurides de Carvalho Marques (De Carvalho Marques, Georgiana Eurides), SOARES, DAYANE CRISTINA COSTA (SOARES, DAYANE CRISTINA COSTA)"
9170200225511874,29042024,Artigo Publicado,Characterization of vegetation structure in areas of natural occurrence of  Hancornia speciosa Gomes,2021,,,,AUSTRALIAN JOURNAL OF CROP SCIENCE (ONLINE),,,"Régilla Martins dos Reis (REIS, R. M.), Ariadne Enes Rocha (ROCHA, A. E.), Mary Jane Nunes Carvalho (CARVALHO, M. J. N.), Larissa de Paula Viana da  Silva (SILVA, L. P. V.), Francisca Helena Muniz (MUNIZ, F. H.), Georgiana Eurides de Carvalho Marques (Marques, Georgiana Eurides de Carvalho), Mário Luiz Ribeiro Mesquita (MESQUITA, M. L. R.)"
9170200225511874,29042024,Artigo Publicado,"Chemical Quality of Landrace Varieties Cultivated in Traditional Communities in the State of Maranhão, Brazil.",2018,,,,Journal of Agricultural Science and Technology B,,,"Djanira dos Santos Rubim (RUBIM, D. S.), Georgiana Eurides de Carvalho Marques (Marques, Georgiana Eurides de Carvalho), Vivian do Carmo Loch (LOCH, V. C.), Roberta Almeida Muniz (MUNIZ, R. A.), Ariadne Enes Rocha (ROCHA, A. E.), Juliane Cutrim Marques (MARQUES, J. C.)"
9170200225511874,29042024,Artigo Publicado,BIOMASS REDUCTION OF ORGANIC MATERIALS IN A DOMESTIC COMPOSTING SYSTEM,2021,,,,BIOFIX SCIENTIFIC JOURNAL (ONLINE),,,"Osmar Luis Vasconcelos (VASCONCELOS, O. L.), Laiza Moraes Carneiro (CARNEIRO, L. M.), Georgiana Eurides de Carvalho Marques (Marques, Georgiana Eurides de Carvalho), Ellen Cristine Nogueira Nojosa (NOJOSA, E. C. N.), Rodrigo Barbosa Lorena (LORENA, R. B.)"
9170200225511874,29042024,Artigo Publicado,HORTA ESCOLAR AGROECOLÓGICA: DINAMIZANDO O PROCESSO DE ENSINOAPRENDIZAGEM PARA RESGATE DOS VALORES TRA,2021,,,,INTERNATIONAL JOURNAL OF DEVELOPMENT RESEARCH,,,"Ellen Cristine Nogueira Nojosa (NOJOSA, E. C. N.), Osmar Luis Vasconcelos (VASCONCELOS, O. L.), Georgiana Eurides de Carvalho Marques (Carvalho Marques, Georgiana Eurides de), Djanira Rubim dos Santos (SANTOS, D. R.), Roberta Almeida Muniz (MUNIZ, R. A.), Kathlen H. S. Nunes (NUNES, K. H. S.), Mateus de Jesus Pereira Gama (GAMA, M. J. P.)"
9170200225511874,29042024,Artigo Publicado,EDUCAÇÃO AMBIENTAL NO MEIO RURAL: ESTUDO DE PRÁTICAS AMBIENTAIS EM ESCOLAS DE ENSINO FUNDAMENTAL NA I LHA DE SÃO LUÍS,2021,,,,Brazilian Journal of Agroecology and Sustainability,,,"Georgiana Eurides de Carvalho Marques (Marques, Georgiana Eurides de Carvalho), Camilla Bezerra Ferreira de Souza (SOUZA, C. B. F.), Leandro Coelho Moura (MOURA, L. C.)"
