numero_identificador,data_atualizacao,tipo,titulo,ano,pais,evento,cidade,periodico,editora,descricao,autores
2920215807337108,7062024,Trabalho em Evento,CARACTERIZAÇÃO QUÍMICA E ATIVIDADE BIOLÓGICA DA BIOMASSA DO FUNGO ENDOFÍTICO Glomerella cingulata,2022.0,Brasil,XXIX Jornadas De Jóvenes Investigadores Eje Interdisciplinario,Sucre- Bolívia,,,,"Nayara de Freitas Gomes (GOMES, N. F.), Antonio José Cantanhede Filho (CANTANHEDE FILHO, ANTONIO JOSÉ), EDSON RODRIGUES FILHO (RODRIGUES FILHO, E.)"
2920215807337108,7062024,Trabalho em Evento,Chemical profile evaluation of the metabolic changes by cationic metals of the biomass produced by endophytic fungus Aspergillus sp. isolated from Dizygostemom riparius (Plantaginaceae) by UPLC  Ultra Performance Liquid Chromatography,2022.0,Brasil,45º Reunião Anual da Sociedade Brasileira de Química,Maceió-AL,,,,"Antonio José Cantanhede Filho (CANTANHEDE FILHO, ANTONIO JOSÉ), Bianca Araújo Santos (SANTOS, B. A.), Anne Karoline Maiorana Santos (SANTOS, A. K. M.), Amanda Beatriz Cunha Silva (SILVA, A. B. C.), Antonio Fernando Vasconcelos Cavalcante Braga (BRAGA, A. F. V. C.), EDSON RODRIGUES FILHO (RODRIGUES FILHO, E.)"
2920215807337108,7062024,Trabalho em Evento,Chemical characterization and antimicrobial activity of the endophytic  fungus Glomerella cingulata biomass associated to Virola Surinamensis,2019.0,Brasil,42º Reunião Anual da Sociedade Brasileira de Química,Joinvile-SC,,,,"Nayara de Freitas Gomes (GOMES, N. F.), Antonio José Cantanhede Filho (CANTANHEDE FILHO, ANTONIO JOSÉ), Fernando José Costa Carneiro (CARNEIRO, F. J. C.), Luis Claudio Nascimento da Silva (SILVA, L. C. N.), Alexsander Rodrigues Carvalho Junior (CARVALHO JUNIOR, A. R.)"
2920215807337108,7062024,Trabalho em Evento,Chemical characterization by LC-MS/MS and antimocrobial activity on  crude extracts of Humiria balsamifera (Aubl,2019.0,Brasil,42º Reunião Anual da Sociedade Brasileira de Química,Joinvile-SC,,,,"Edelson de Jesus Sá Dias (DIAS, E. J. S.), Antonio José Cantanhede Filho (CANTANHEDE FILHO, ANTONIO JOSÉ), Fernando José Costa Carneiro (CARNEIRO, F. J. C.), CLÁUDIA QUINTINO ROCHA (ROCHA, C. Q.), Luis Claudio Nascimento da Silva (SILVA, L. C. N.), Juliane Cutrin Marques (MARQUES, J. C.)"
2920215807337108,7062024,Trabalho em Evento,Secondary metabolism differentiation in Talaromyces fuscoviridis and T. aurelinus induced by Zn (II),2023.0,Brasil,9th Brazilian Conference on Natural Product/ XXXV RESEM,Salvador-BA,,,,"Mauricio Augusto Pinto Moreno da Silva Alves (ALVES, M. A. P. M. S.), João Paulo dos Santos Soares (SOARES, J. P. S.), Antonio José Cantanhede Filho (CANTANHEDE FILHO. A. J.), EDSON RODRIGUES FILHO (RODRIGUES FILHO, E.)"
2920215807337108,7062024,Trabalho em Evento,Composição química do óleo obtido do extrato hexânico da biomassa fúngica do endófito Penicillium citrinum associado à Moutabea guianensis Aubl.,2014.0,Brasil,54° Congresso Brasileiro de Química- Química e Sociedade: Motores da Sustentabilidade,Natal-RN,,,,"Luidi Cardoso (CARDOSO, L.), Haroldo da Silva Ripardo (RIPARDO, H. S.), Elinaldo da Silva Andrade (ANDRADE, E. S.), Orlando Santos Neto (SANTOS NETO, O.), Antonio José Cantanhede Filho (CANTANHEDE FILHO, A. J.), Railda Neiva Moreira Araujo (ARAUJO, R. N. M.), Marivaldo José Costa Corrêa (CORREA, M. J. C.), Giselle Maria Skelding Guilhon (GUILHON, G. M. S.), Lourivaldo da Silva Santos (SANTOS, L. S.)"
7768340690883764,5042024,Trabalho em Evento,Risco e formaçao profissional: o caso da funçao e profissao do engenheiro e do desenhista industrial,2004.0,Brasil,4º Encontro Humanístico da UFMA,Sao Luís,,,,"Camila Andrade dos Santos (SANTOS, Camila Andrade dos)"
7768340690883764,5042024,Trabalho em Evento,Risco e formação profissional: o caso do exercício da profissão do desenhista industrial,2004.0,Brasil,XVI Seminário de Iniciação Científica,São Luís,,,,"Camila Andrade dos Santos (SANTOS, Camila Andrade dos)"
7768340690883764,5042024,Trabalho em Evento,"A mediação da preocupação com o risco entre designer, clientela e fabricante",2005.0,Brasil,XVII Seminário de Iniciação Científica da UFMA,São Luís,,,,"Camila Andrade dos Santos (SANTOS, Camila Andrade dos)"
7768340690883764,5042024,Trabalho em Evento,Brincando com o imaginário: proposta de um brinquedo didático-pedagógico,2009.0,Brasil,Congresso de Pesquisa e Inovação da Rede Norte Nordeste de Educação,Teresina,,,,"Iana Teresa Moura Gomes (Gomes Iana Teresa Moura), Camila Andrade dos Santos (SANTOS, Camila Andrade dos)"
7768340690883764,5042024,Trabalho em Evento,Curtimento de couro de peixe: identificando um potencial local,2009.0,Brasil,III Congresso de poluentes orgânicos e I Seminário da pós Graduação em Educação Ambiental e Gestão Participativa de Recursos Hídricos,São Luís,,,,"Camila Andrade dos Santos (SANTOS, Camila Andrade dos), Tito Carvalho Tsuji (TSUJI, T. C.), Ozelito (Amarante Junior, Ozelito Possidônio de)"
7768340690883764,5042024,Trabalho em Evento,Educação Ambiental e desenvolvimento local com base no Ecodesign,2009.0,Brasil,Semana de Educação Ambiental do IFMA,São Luís,,,,"Camila Andrade dos Santos (SANTOS, Camila Andrade dos)"
7768340690883764,5042024,Trabalho em Evento,As várias faces dos artefatos: identidade e novas atribuições de significados,2011.0,Brasil,Congresso NOrte e Nordeste de Pesquisa e Inovação Tecnológica,Natal,,,,"Camila Andrade dos Santos (SANTOS, Camila Andrade dos)"
7768340690883764,5042024,Trabalho em Evento,Design etnográfico: uma proposta metodológica,2009.0,Brasil,V Congresso Internacional de Pesquisa em Design,Bauru,,,,"Benedito Souza Filho (SOUZA FILHO, Benedito), Raquel Gomes Noronha (Noronha, Raquel Gomes), Camila Andrade dos Santos (SANTOS, Camila Andrade dos)"
7768340690883764,5042024,Trabalho em Evento,Curtimento de Couro de Peixe: Identificando Um Potencial Local,2009.0,Brasil,III Encontro de Pesquisadores de Poluentes Orgânicos em Ambientes Aquáticos e Terrestres e I Seminário do Curso de Pós Graduação Em Educação Ambiental e Gestão Participativa de Recursos Hídricos,São Luís,,,,"Camila Andrade dos Santos (SANTOS, Camila Andrade dos)"
7768340690883764,5042024,Trabalho em Evento,"Estudo tipográico dos nomes das embarcações tradicionais da ilha do Maranhão: estilo, identidade e significados",2012.0,Brasil,IIV Congresso de Norte e Nordeste de Pesquisa e Inovação - CONEPPI,Palmas/TO,,,,"Camila Andrade dos Santos (SANTOS, Camila Andrade dos), Ilmarana Caroline Marques Ribeiro (RIBEIRO, I. C. M.), Thamyres Sousa Lavra Silva (SILVA, T. S. L.)"
7768340690883764,5042024,Trabalho em Evento,Aperfeiçoamento da técnica de curtimento de couro de peixe utilizando taninos vegetais,2012.0,Brasil,IIV Congresso Norte e Nordeste de Pesquisa e Inovação,Palmas/TO,,,,"Camila Andrade dos Santos (SANTOS, Camila Andrade dos), Emanuelle Francisca Nunes Gomes (GOMES, E. F. N.), Isabela Camara Dias (DIAS, I. C.), Mariana Marta Ferreira Varela (VARELA, M. M. F.)"
7768340690883764,5042024,Trabalho em Evento,Projeto semente: o trabalho do designer no contexto da implementação de uma política publica participativa,2015.0,Brasil,VII Jornada Internacional de Políticas Públicas,São Luís,,,,"Camila Andrade dos Santos (SANTOS, Camila Andrade dos), Luzenice Macedo Martins (MARTINS, L. M.), Tayce Maria Saenz Artioli Costa (COSTA, T. M. S. A.), Francimary Macedo Martins (MARTINS, F. M.)"
7768340690883764,5042024,Trabalho em Evento,"INCLUSÃO E ACESSIBILIDADE À INFORMAÇÃO POR MEIO DO DESIGN: GRÁFICOS TÁTEIS DE AZULEJOS COLONIAIS DAS CIDADES DE SÃO LUÍS/BR, LISBOA E PORTO/PT",2020.0,Brasil,XX Congresso Brasileiro de Ergonomia  Virtual 2020,ABERGO,,,,"Camila Andrade dos Santos (SANTOS, CAMILA ANDRADE DOS), COSTA, TAYCE M S ARTIOLI (COSTA, TAYCE M S ARTIOLI), JÚLIA, PEREIRA (JÚLIA, PEREIRA), NOVAES, CLEYDSON MIRANDA (NOVAES, CLEYDSON MIRANDA), JORGE, RENATO NATAL (JORGE, RENATO NATAL), MAIA, IVANA MARCIA OLIVEIRA (MAIA, IVANA MARCIA OLIVEIRA)"
7768340690883764,5042024,Trabalho em Evento,Portugal PDC Place,2022.0,Brasil,PDC 2022: Participatory Design Conference 2022,Newcastle upon Tyne United Kin,,,,"ANTUNES, INES PINHEIRO (ANTUNES, INES PINHEIRO), MELO, ANA (MELO, ANA), Camila Andrade dos Santos (DOS SANTOS, CAMILA ANDRADE), RODRIGUES, SANDRA GOMES (RODRIGUES, SANDRA GOMES)"
7768340690883764,5042024,Trabalho em Evento,O fluxo dos materiais na feitura da bola de mangaba em Patizal: reflexões sobre sustentabilidade,2022.0,Brasil,III Jornada de Pesquisa do Programa de PósGraduação em Design  UFMA,São Luís,,,,"Camila Andrade dos Santos (SANTOS, CAMILA ANDRADE DOS), Raquel Gomes Noronha (Noronha, Raquel Gomes), SILVA, JOSUÉ DOS SANTOS DA (SILVA, JOSUÉ DOS SANTOS DA)"
7768340690883764,5042024,Trabalho em Evento,Pesquisa em Design com crianças: caminhos possíveis,2021.0,Brasil,II Jornada de Pesquisa do Programa de PósGraduação em Design  UFMA,São Luís,,,,"Camila Andrade dos Santos (SANTOS, CAMILA ANDRADE DOS), GUIMARÃES, MÁRCIO JAMES SOARES (GUIMARÃES, MÁRCIO JAMES SOARES)"
7768340690883764,5042024,Trabalho em Evento,Do design do brincado ao design do brincante: um ensaio. sobre a criança criadora,2022.0,Brasil,Coloquio de Pesquisa e Design,Fortaleza,,,,"Camila Andrade dos Santos (SANTOS, Camila Andrade dos)"
7768340690883764,5042024,Trabalho em Evento,COMUNICAR ATRAVÉS DA IMAGEM: EXPLORANDO A CATEGORIA DO BRINCAR NO QUILOMBO URBANO DA LIBERDADE POR MEIO DO MÉTODO DE PHOTOVOICE,2022.0,Brasil,Anais do Universo IFMA 2022,IFMA,,,,"LEITE, LUCAS MARTINS (LEITE, LUCAS MARTINS), Camila Andrade dos Santos (SANTOS, CAMILA ANDRADE DOS), MAIA, IVANA OLIVEIRA (MAIA, IVANA OLIVEIRA)"
7768340690883764,5042024,Trabalho em Evento,Photovoice and research with children in Design and Architecture ?  proximity between researchers and research subjects,2022.0,Brasil,REDES Conference: proximity,Lisboa,,,,"Camila Andrade dos Santos (ANDRADE DOS SANTOS, CAMILA)"
7768340690883764,5042024,Trabalho em Evento,Photovoice and research with children in Design and Architecture - Proximity between researchers and research subjects,2022.0,Brasil,Research and Education in Design Conference,Lisboa,,,,"Rosa Arma (Arma, Rosa), Camila Andrade dos Santos (SANTOS, CAMILA ANDRADE DOS)"
6376710096145623,12052024,Trabalho em Evento,Princípios de Química Verde em práticas de Química Orgânica: Identificação de Cetonas utilizando o Teste do Iodofórmio,2015.0,Brasil,67ª REUNIÃO ANUAL DA SBPC,SÃO CARLOS,,,,"Milena Cardoso Silva (SILVA, M. C.), Tácira Karoline Pereira Nascimento (NASCIMENTO, T. K. P.), Talita Costa Lara (LARA, T. C.), Thais Silva Catanhêde (CATANHEDE, T. S.), Thayná Matos de Sousa (SOUSA, T. M.), Lisa Hauane de Melo Santana (SANTANA, L. H. M.), Carlos Henrique Melo Macedo (MACEDO, C. H. M.), NAZARÉ DO SOCORRO LEMOS SILVA VASCONCELOS (VASCONCELOS, N.S.L.S.), Clenilma Marques Brandão (BRANDAO, C. M.)"
6376710096145623,12052024,Trabalho em Evento,Princípios de Química Verde em práticas de Química Orgânica: Identificação de Aldeídos utilizando Teste de Tollens,2015.0,Brasil,67ª REUNIÃO ANUAL DA SBPC,SÃO CARLOS,,,,"Daniela Almeida da Hora (HORA, D. A.), Jaciara Cristina Moreira Mendes (MENDES, J. C. M.), Jaqueline Daniele Santos Barros (BARROS, J. D. S.), Lisa Hauane de Melo Santana (SANTANA, L. H. M.), Rafaela Cândida da Silva (SILVA, R. C.), Carlos Henrique Melo Macedo (MACEDO, C. H. M.), NAZARÉ DO SOCORRO LEMOS SILVA VASCONCELOS (VASCONCELOS, N.S.L.S.), Clenilma Marques Brandão (BRANDAO, C. M.)"
6376710096145623,12052024,Trabalho em Evento,CONDIÇÕES HIGIÊNICO-SANITÁRIAS DA ÁGUA CONSUMIDA PELA COMUNIDADE RURAL BARRA DO SACO NO MUNICÍPIO DE CODÓ - MA,2013.0,Brasil,VIII CONGRESSO NORTE NORDESTE DE PESQUISA E INOVAÇÃO - CONNEPI,SALVADOR,,,,"Meirinalva Batista Miranda Coelho (COELHO, M. B. M.), Ana Luiza Privado Martins (MARTINS, A. L. P.), Clenilma Marques Brandão (BRANDAO, C. M.), Mariano Oscar Aníbal Ibañez Rojas (ROJAS, M. O. A. I.), Deyse Rossana Silva de Araújo (ARAUJO, D. R. S.)"
6376710096145623,12052024,Trabalho em Evento,"FATORES SOCIOECONÔMICOS E O TRATAMENTO DOMÉSTICO DA ÁGUA EM UM BAIRRO DO MUNICÍPIO DE CODÓ, MARANHÃO",2013.0,Brasil,VIII CONGRESSO NORTE NORDESTE DE PESQUISA E INOVAÇÃO (CONNEPI),SALVADOR,,,,"Ana Luiza Privado Martins (MARTINS, A. L. P.), Meirinalva Batista Miranda Coelho (COELHO, M. B. M.), Clenilma Marques Brandão (BRANDAO, C. M.), Walbert Sousa da Silva (SILVA, W. S.)"
6376710096145623,12052024,Trabalho em Evento,Determinação de teor de biodiesel em mistura biodiesel:diesel utilizando a espectrofotometria UV-Vis.,2009.0,Brasil,32ª Reunião Anual da Sociedade Brasileira de Química,FORTALEZA,,,,"Clenilma Marques Brandão (BRANDAO, C. M.), LEANDRO DE SOUSA ROSA (ROSA, L.S), Cristiane Italiano Cordeiro (Cordeiro, Cristiane I.), Fabiana Bernardes Viana (Viana, F. B.), ANTONIO FRANCISCO FERNANDES DE VASCONCELOS (VASCONCELOS, A. F. F.), LIDIA SANTOS PEREIRA MARTINS (MARTINS, L.S.P)"
6376710096145623,12052024,Trabalho em Evento,"Aplicação da espectrofotometria UV-vis na determinação de glicerina livre em biodieseis de babaçu, soja, milho e blendas",2009.0,Brasil,32ª Reunião Anual de Sociedade Brasileira de Química,FORTALEZA,,,,"LEANDRO DE SOUSA ROSA (ROSA, L.S), Clenilma Marques Brandão (BRANDAO, C. M.), Cristiane Italiano Cordeiro (Cordeiro, Cristiane I.), Fabiana Bernardes Viana (Viana, F. B.), Keyll Carlos Ribeiro Martins (MARTINS, K. C. R.), ANTONIO FRANCISCO FERNANDES DE VASCONCELOS (VASCONCELOS, A. F. F.), LIDIA SANTOS PEREIRA MARTINS (MARTINS, L.S.P)"
6376710096145623,12052024,Trabalho em Evento,Avaliação do efeito corrosivo dos biodieseis de babaçu e soja,2009.0,Brasil,32ª Reunião Anual da Sociedade Brasileira de Química,FORTALEZA,,,,"Cristiane Italiano Cordeiro (Cordeiro, Cristiane I.), Fabiana Bernardes Viana (Viana, F. B.), Clenilma Marques Brandão (BRANDAO, C. M.), LEANDRO DE SOUSA ROSA (ROSA, L.S), ANTONIO FRANCISCO FERNANDES DE VASCONCELOS (VASCONCELOS, A. F. F.), LIDIA SANTOS PEREIRA MARTINS (MARTINS, L.S.P)"
6376710096145623,12052024,Trabalho em Evento,Aplicação da espectrofotometria na determinação de traços de glicerina livre em biodiesel e blendas,2008.0,Brasil,1º Simpósio de Nacional de Biocombustíveis - BIOCOM,RECIFE,,,,"LEANDRO DE SOUSA ROSA (ROSA, L.S), Clenilma Marques Brandão (BRANDAO, C. M.), Cristiane Italiano Cordeiro (Cordeiro, Cristiane I.), Fabiana Bernardes Viana (Viana, F. B.), Keyll Carlos Ribeiro Martins (MARTINS, K. C. R.), ANTONIO FRANCISCO FERNANDES DE VASCONCELOS (VASCONCELOS, A. F. F.), LIDIA SANTOS PEREIRA MARTINS (MARTINS, L.S.P)"
6376710096145623,12052024,Trabalho em Evento,Avaliação da corrosividade do biodiesel de soja,2008.0,Brasil,1º Simpósio Nacional de Biocombustíveis - BIOCOM,RECIFE,,,,"Cristiane Italiano Cordeiro (Cordeiro, Cristiane I.), Fabiana Bernardes Viana (Viana, F. B.), Clenilma Marques Brandão (BRANDAO, C. M.), LEANDRO DE SOUSA ROSA (ROSA, L.S), ANTONIO FRANCISCO FERNANDES DE VASCONCELOS (VASCONCELOS, A. F. F.), LIDIA SANTOS PEREIRA MARTINS (MARTINS, L.S.P)"
6376710096145623,12052024,Trabalho em Evento,Otimização de parâmetros experimentais de análises espectrofométricas para determinação de teor de biodiesel etílico de soja em blendas,2008.0,Brasil,XX Seminário de Iniciação Científica,SÃO LUIS,,,,"Clenilma Marques Brandão (BRANDAO, C. M.), LEANDRO DE SOUSA ROSA (ROSA, L.S), Cristiane Italiano Cordeiro (Cordeiro, Cristiane I.), ANTONIO FRANCISCO FERNANDES DE VASCONCELOS (VASCONCELOS, A. F. F.), LIDIA SANTOS PEREIRA MARTINS (MARTINS, L.S.P)"
6376710096145623,12052024,Trabalho em Evento,PRODUÇÃO E CARACTERIZAÇÃO DE BIODIESEL DE BABAÇU E SOJA POR ROTA ETÍLICA,2007.0,Brasil,XIX SEMINARIO DE INICIAÇÃO CIENTIFICA DA UEMA,SÃO LUÍS,,,,"Clenilma Marques Brandão (BRANDAO, C. M.), LEANDRO DE SOUSA ROSA (ROSA, L.S), LIDIA SANTOS PEREIRA MARTINS (MARTINS, L.S.P), ANTONIO FRANCISCO FERNANDES DE VASCONCELOS (VASCONCELOS, A. F. F.)"
6376710096145623,12052024,Trabalho em Evento,Justo Jansen e a institucionalização da ciência no Maranhão (final do séc. XIX e início do séc. XX),2012.0,Brasil,SIMPÓSIO INTERNACIONAL DE HISTÓRIA PÚBLICA,SÃO PAULO,,,,"Clenilma Marques Brandão (BRANDAO, C. M.)"
6376710096145623,12052024,Trabalho em Evento,Identificação e Quantificação de Alumínio em Desodorantes Antitranspirantes.,2015.0,Brasil,55º Congresso Brasileiro de Química,Goiânia,,,,"Erica Caroline Diniz (DINIZ, E. C.), Beatriz Borges Oliveira Lima (LIMA, B. B. O.), Ana Beatriz Azevedo Pereira (PEREIRA, A. B. A.), Danielly Martins Lima (LIMA, D. M.), Clenilma Marques Brandão (BRANDAO, C. M.), Nazaré do Socorro Lemos Silva Vasconcelos. (VASCONCELOS., N. S. L. S.)"
6376710096145623,12052024,Trabalho em Evento,Incentivo à Pesquisa em Disciplinas Técnicas,2015.0,Brasil,"X CONGRESSO NORTE, NORDESTE DE PESQUISA E INOVAÇÃO",RIO BRANCO - AC,,,,"Ana Beatriz Azevedo Pereira (PEREIRA, A. B. A.), Beatriz Borges Oliveira Lima (LIMA, B. B. O.), Clenilma Marques Brandão (BRANDAO, C. M.), Erica Caroline Diniz (DINIZ, E. C.), Danielly Martins Lima (LIMA, D. M.), Nazaré do Socorro Lemos Silva Vasconcelos. (VASCONCELOS., N. S. L. S.)"
6376710096145623,12052024,Trabalho em Evento,Chemical waste reduction in teaching laboratories: a green chemistry proposal,2016.0,Brasil,39ª Reunião Anual da Sociedade Brasileira de Química (SBQ),Goiânia,,,,"Clenilma Marques Brandão (BRANDAO, C. M.), Nazaré do Socorro Lemos Silva Vasconcelos. (VASCONCELOS., N. S. L. S.), DIANA SILVA DE ARAUJO (ARAUJO, D. S.), Kiany Sirley Brandão Cavalcante (CAVALCANTE, K. S. B.), Carlos Henrique Melo Macedo (MACEDO, C. H. M.)"
6376710096145623,12052024,Trabalho em Evento,Qualidade de Polpas de Frutas comercializadas em Feiras Agroecológicas no Estado do Maranhão.,2016.0,Brasil,68ª Reunião Anual da Sociedade Brasielira para o Progresso da Ciência,Porto Seguro - BA,,,,"José Felipi Sousa Lima (LIMA, J. F. S.), Georgiana E. de C. Marques (MARQUES, G. E. C.), Bruna Rayana dos Santos Sampaio (SAMPAIO, B. R. S.), Lisa Hauane de Melo Santana (SANTANA, L. H. M.), Marciel N. Justino (JUSTINO, M. N.), Dayany S. B. Nascimento (NASCIMENTO, D. S. B.), Kassandra S. de Almeida (ALMEIDA, K. S.), Roberta A. Muniz (MUNIZ, R. A.), Marta C. C. de A. Costa (COSTA, M. C. C. A.), Clenilma Marques Brandão (BRANDAO, C. M.)"
6376710096145623,12052024,Trabalho em Evento,Minimização de resíduos químicos em laboratórios de ensino e pesquisa,2016.0,Brasil,"Encontro de Pós-Graduação do Instituto Federal de Educação, Ciência e Tecnologia do Maranhão",São Luís - MA,,,,"Clenilma Marques Brandão (BRANDAO, C. M.), DIANA SILVA DE ARAUJO (ARAUJO, D. S.), Nazaré do Socorro Lemos Silva Vasconcelos. (VASCONCELOS., N. S. L. S.)"
6376710096145623,12052024,Trabalho em Evento,Química em velocidade máxima: ações do PIBID no Centro de Ensino Médio Gonçalves Dias em São Luís-MA,2016.0,Brasil,XVIII Encontro Nacional de Ensino de Química (ENEQ),Florianópolis,,,,"Matheus Henrique da Silva Ribeiro (RIBEIRO, M. H. S.), Emily Cristina Silva Sousa Ramos (RAMOS, E. C. S. S.), Anailde Carvalho Costa (COSTA, A. C.), Kiany Sirley Brandão Cavalcante (CAVALCANTE, K. S. B.), Clenilma Marques Brandão (BRANDAO, C. M.)"
6376710096145623,12052024,Trabalho em Evento,Construção de estruturas carbônicas: um recurso para o ensino de química orgânica,2016.0,Brasil,XVIII Encontro Nacional de Ensino de Química (ENEQ),Florianópolis,,,,"Matheus Henrique da Silva Ribeiro (RIBEIRO, M. H. S.), Emily Cristina Silva Sousa Ramos (RAMOS, E. C. S. S.), Fiama Martins Cutrim (CUTRIM, F. M.), Anailde Carvalho Costa (COSTA, A. C.), Clenilma Marques Brandão (BRANDAO, C. M.), Kiany Sirley Brandão Cavalcante (CAVALCANTE, K. S. B.)"
6376710096145623,12052024,Trabalho em Evento,A contribuição da monitoria na formação docente no curso de Licenciatura em Química,2016.0,Brasil,XVIII Encontro Nacional de Ensino de Química (ENEQ),Florianópolis,,,,"Suzana Lino da Silva (SILVA, S. L.), Clenilma Marques Brandão (BRANDAO, C. M.), Nazaré do Socorro Lemos Silva Vasconcelos. (VASCONCELOS., N. S. L. S.)"
6376710096145623,12052024,Trabalho em Evento,Chemical characterization of Stemodia arizonica Pennell essential oil,2017.0,Brasil,46th World Chemistry Congress / 40ª Reunião Anual da Sociedade Brasileira de Química,São Paulo,,,,"Clenilma Marques Brandão (BRANDAO, C. M.), Yan M. L. Fernandes (FERNANDES, Y. M. L.), Lanna K. Silva (SILVA, L. K.), José G. Soares Maia (MAIA, J. G. S.), Odair dos S. Monteiro (MONTEIRO, O. S.), Georgiana E. de C. Marques (MARQUES, G. E. C.), Rogério de M. Teles (TELES, R. M.), Kiany S. B. Cavalcante (CAVALCANTE, K. S. B.)"
6376710096145623,12052024,Trabalho em Evento,Estudo químico do óleo essencial de espécie vegetal encontrada em São  Benedito do rio Preto - MA e sua  aplicação como larvicida do Aedes aegypti,2018.0,Brasil,58º Congresso Brasileiro de Química ?Química: Sociedade e Qualidade de Vida?,São Luís,,,,"Ester Lopes Menezes (MENEZES, E. L.), Thiago de Jesus Sousa Pinto (PINTO, T. J. S.), Clenilma Marques Brandão (BRANDAO, C. M.), Kiany Sirley Brandão Cavalcante (CAVALCANTE, K. S. B.), Rogério de Mesquita Teles (TELES, R. M.)"
6376710096145623,12052024,Trabalho em Evento,Avaliação da atividade antimicrobiana do óleo essencial de Plantaginaceae Dizygostemon sp. frente à Escherichia coli e Staphylococcus aureus,2018.0,Brasil,58º Congresso Brasileiro de Química ?Química: Sociedade e Qualidade de Vida?,São Luís,,,,"Gabriel Pereira Dias (DIAS, G. P.), Clenilma Marques Brandão (BRANDAO, C. M.), Rogério de Mesquita Teles (TELES, R. M.), Alexsander Rodrigues Carvalho Junior (CARVALHO JUNIOR, A. R.), Luís Cláudio Nascimento da Silva (SILVA, L. C. N.), Kiany Sirley Brandão Cavalcante (CAVALCANTE, K. S. B.)"
6376710096145623,12052024,Trabalho em Evento,Dietary fiber content in fruit pulps of Mauritia flexuosa mart. and platonia insiginis mart,2017.0,Brasil,46th World Chemistry Congress / 40ª Reunião Anual da Sociedade Brasileira de Química,São Paulo,,,,"Anne Karoline Maiorana Santos (SANTOS, A. K. M.), Georgiana E. de C. Marques (MARQUES, G. E. C.), A S FONSECA (FONSECA, A. S.), Juliane Cutrim Marques (MARQUES, J. C.), Andrey Luan Marques Melo (MELO, A. L. M.), Clenilma Marques Brandão (BRANDAO, C. M.)"
6376710096145623,12052024,Trabalho em Evento,EXPERIÊNCIAS SUSTENTÁVEIS EM LABORATÓRIOS DE QUÍMICA DO IFMA: GERENCIAMENTO DE RESÍDUOS QUÍMICOS E EXPERIMENTOS EM PEQUENA ESCALA,2018.0,Brasil,"ENCONTRO DE PESQUISA, PÓS-GRADUAÇÃO, INOVAÇÃO, INICIAÇÃO A DOCÊNCIA E EXTENSÃO (EPIDE 2018)",São Luís,,,,"Clenilma Marques Brandão (BRANDAO, C. M.), DIANA SILVA DE ARAUJO (ARAUJO, D. S.), NAZARÉ DO SOCORRO LEMOS SILVA VASCONCELOS (VASCONCELOS, N.S.L.S.)"
6376710096145623,12052024,Trabalho em Evento,Cienciarte: um espaço de construção de saberes para graduandos no IFMA Campus São Luís - Monte Castelo,2019.0,Brasil,V Colóquio Nacional e II Colóquio Internacional,Natal,,,,"Regina Lucia Muniz Ribeiro (RIBEIRO, R. L. M.), Daniely Veronica Viana Cardoso (CARDOSO, D. V. V.), Marcio Henrique Campos Frazão (FRAZAO, M. H. C.), Ziel dos Santos Cardoso (CARDOSO, Z. S.), Maria das Graças Sampaio Costa (COSTA, M. G. S.), Clenilma Marques Brandão (BRANDAO, C. M.), Kiany Sirley Brandão Cavalcante (CAVALCANTE, K. S. B.)"
6376710096145623,12052024,Trabalho em Evento,Desenvolvimento e Avaliação de um aplicativo móvel (QUIMEXPLAB) como recurso didático nas atividades práticas de química,2019.0,Brasil,I Simpósio Internacional e IV Nacional de Tecnologias Digitais na Educação - SNTDE 2019,São Luís,,,,"Paulo Henrique Corvelo Lima (LIMA, P. H. C.), Francisco da Conceição Silva (SILVA, F. C.), Arlan Silva Freitas (FREITAS, A. S.), Maria das Graças Sampaio Costa (COSTA, M. G. S.), Clenilma Marques Brandão (BRANDAO, C. M.)"
6376710096145623,12052024,Trabalho em Evento,CIENCIARTE: um espaço de formação no âmbito da educação profissional técnica,2019.0,Brasil,Encontro de Ensino e Divulgação da Química - 15 e 16/11/2019,Coimbra - Portugal,,,,"Regina Lucia Muniz Ribeiro (RIBEIRO, R. L. M.), Daniely Veronica Viana Cardoso (CARDOSO, D. V. V.), Marcio Henrique Campos Frazão (FRAZAO, M. H. C.), Ziel dos Santos Cardoso (CARDOSO, Z. S.), Clenilma Marques Brandão (BRANDAO, C. M.), Kiany S. B. Cavalcante (CAVALCANTE, K. S. B.), Maria das Graças Sampaio Costa (COSTA, M. G. S.), Tito C. Tsuji (TSUJI, T. C.)"
6376710096145623,12052024,Trabalho em Evento,SABOR E SABER TRADICIONAL EM COOKIES A BASE DA FARINHA DE JATOBÁ (HYMENAEA COURBARIL L.),2019.0,Brasil,XI Congresso Brasileiro de Agroecologia,São Cristóvão ? SE,,,,"Gabryela Diniz Dias (DIAS, G. D.), Georgiana Eurides de Carvalho Marques (MARQUES, G. E. C.), Clenilma Marques Brandão (BRANDAO, C. M.)"
6376710096145623,12052024,Trabalho em Evento,Análise proteica de polpas in natura das frutíferas nativas no Maranhão.,2017.0,Brasil,57o Congresso Brasileiro de Química,Gramado- RS,,,,"Anne Karoline Maiorana Santos (SANTOS, A. K. M.), Adriano Souza Fonseca (FONSECA, A. S.), Andressa Rose Castro Costa (COSTA, A. R. C.), Clenilma Marques Brandão (BRANDAO, C. M.), Georgiana Eurides de Carvalho Marques (MARQUES, G. E. C.), Djanira Rubim dos Santos (SANTOS, D. R.), Lucas Silva de Abreu (ABREU, L. S.)"
6376710096145623,12052024,Trabalho em Evento,PRODUÇÃO DE SABONETES ARTESANAIS À BASE DE EXTRATOS DE FOLHAS DE HYMENAEA COURBARIL L..,2020.0,Brasil,Congresso Internacional on line de Biocosmésticos e Fitoprodutos (BIOFITO),Evento on line 27-29 de julho,,,,"Ricardo Santos Avelar (AVELAR, R. S.), Georgiana Eurides de Carvalho Marques (MARQUES, G. E. C.), Clenilma Marques Brandão (BRANDAO, C. M.), Suzana dos Anjos da Paz (PAZ, S. A.)"
