numero_identificador,data_atualizacao,tipo,titulo,ano,pais,evento,cidade,periodico,editora,descricao,autores
6579292885078121,4042024,Trabalho em Evento,JETetris: a Collaborative Educational Game,2005.0,Brasil,2º Workshop TIDIA FAPESP 2005,São Paulo,,,,"Jeane Silva Ferreira Teixeira (TEIXEIRA, Jeane Silva Ferreira), Eveline de Jesus Viana Sá (SÁ, E. J. V.), Clovis Torres Fernandes (FERNANDES, Clovis Torres), José Maria Parente de Oliveira (OLIVEIRA, José Maria Parente de), Tatiane Prudêncio (PRUDÊNCIO, Tatiane), Inaldo Costa (COSTA, Inaldo), D'Ilton Silveira (SILVEIRA, D'ilton)"
6579292885078121,4042024,Trabalho em Evento,Design de Atividades de Aprendizagem que usam Jogos como princípio para Cooperação,2007.0,Brasil,SBIE 2007 XVII Simpósio Brasileiro de Informática na Educação,São Paulo,,,,"Eveline de Jesus Viana Sá (SÁ, E. J. V.), Jeane Silva Ferreira Teixeira (TEIXEIRA, Jeane Silva Ferreira), Clovis Torres Fernandes (FERNANDES, Clovis Torres)"
6579292885078121,4042024,Trabalho em Evento,Towards a Collaborative Learning Flow Pattern using Educational Games in Learning Activities.,2007.0,Canadá,E-Learn 2007Conference  (AACE - Association for the Advancement of Computing in Education ),Quebec City,,,,"Eveline de Jesus Viana Sá (SÁ, E. J. V.), Jeane Silva Ferreira Teixeira (TEIXEIRA, Jeane Silva Ferreira), Clovis Torres Fernandes (FERNANDES, Clovis Torres)"
6579292885078121,4042024,Trabalho em Evento,Digital Scenes of Pedagogical Use Using Learning Objects of the Educational Games Type,2007.0,Canadá,"E-Learn 2007--World Conference on E-Learning in Corporate, Government, Healthcare, and Higher Education",Quebec,,,,"Jeane Silva Ferreira Teixeira (TEIXEIRA, Jeane Silva Ferreira), Eveline de Jesus Viana Sá (SÁ, E. J. V.), Clovis Torres Fernandes (FERNANDES, Clovis Torres)"
6579292885078121,4042024,Trabalho em Evento,Rumo a um Padrão para Especificação de Uso do Jogo em Atividades de Aprendizagem,2010.0,Brasil,SBSC 2010 - Simpósio Brasileiro de Sistemas Colaborativos,Belo Horizonte - MG,,,,"Eveline de Jesus Viana Sá (SÁ, E. J. V.), Jeane Silva Ferreira Teixeira (TEIXEIRA, Jeane Silva Ferreira), Clovis Torres Fernandes (FERNANDES, Clovis Torres)"
6579292885078121,4042024,Trabalho em Evento,Modelagem de Atividades de Aprendizagem com Uso de Jogos e Cooperação,2010.0,Brasil,"SBIE 2009 XIX Simpósio Brasileiro de Informática na Educação,",João Pessoa - PB,,,,"Eveline de Jesus Viana Sá (SÁ, E. J. V.), Jeane Silva Ferreira Teixeira (TEIXEIRA, Jeane Silva Ferreira), Clovis Torres Fernandes (FERNANDES, Clovis Torres)"
6579292885078121,4042024,Trabalho em Evento,Uma Proposta para Indexação Semântica de Objetos de Aprendizagem.,2011.0,Brasil,LACLO'2011 - Sixth Latin American Conference on Learning Objects and Technology in Education,Montevideo,,,,"Jeane Silva Ferreira Teixeira (TEIXEIRA, Jeane Silva Ferreira), Eveline de Jesus Viana Sá (SÁ, E. J. V.), Clovis Torres Fernandes (FERNANDES, Clovis Torres)"
6579292885078121,4042024,Trabalho em Evento,Jogo Parametrizável como Recurso Didático-Pedagógico: Que Rumos Seguir?.,2011.0,Brasil,"VII Seminário Jogos Eletrônicos, Educação e Comunicação,",Fortaleza,,,,"Jeane Silva Ferreira Teixeira (TEIXEIRA, Jeane Silva Ferreira), Eveline de Jesus Viana Sá (SÁ, E. J. V.), Clovis Torres Fernandes (FERNANDES, Clovis Torres)"
6579292885078121,4042024,Trabalho em Evento,Modelo de Estrutura de Atividades de Aprendizagem com uso de Jogos e Cooperação,2011.0,Brasil,XXII Simpósio Brasileiro de Informática na Educação,Aracaju,,,,"Eveline de Jesus Viana Sá (SÁ, E. J. V.), Jeane Silva Ferreira Teixeira (TEIXEIRA, Jeane Silva Ferreira), Clovis Torres Fernandes (FERNANDES, Clovis Torres), Marcio Varchavsk (VARCHAVSK, M.)"
6579292885078121,4042024,Trabalho em Evento,Folksonomia e Taxonomia aplicadas ao Processo de Indexação e Organização de Jogos Educacionais,2011.0,Brasil,XXII Simpósio Brasileiro de Informática na Educação,Aracaju,,,,"Jeane Silva Ferreira Teixeira (TEIXEIRA, Jeane Silva Ferreira), Eveline de Jesus Viana Sá (SÁ, E. J. V.), Clovis Torres Fernandes (FERNANDES, Clovis Torres)"
6579292885078121,4042024,Trabalho em Evento,Game Labeler: Um Jogo para Aquisição de Características de Jogos Educacionais.,2011.0,Brasil,SBGames'2011 - X Simpósio Brasileiro de Games e Entretenimento Digital,Salvador,,,,"Jeane Silva Ferreira Teixeira (TEIXEIRA, Jeane Silva Ferreira), Eveline de Jesus Viana Sá (SÁ, E. J. V.), Clovis Torres Fernandes (FERNANDES, Clovis Torres)"
6579292885078121,4042024,Trabalho em Evento,Busca e Recuperação de Jogos Educacionais: Uma Ontologia Representativa do Contexto de Aprendizagem,2013.0,Brasil,Workshop Brasileiro de Web Semântica e Educação,Campinas,,,,"Jeane Silva Ferreira Teixeira (TEIXEIRA, Jeane Silva Ferreira), Eveline de Jesus Viana Sá (SÁ, E. J. V.), Clovis Torres Fernandes (FERNANDES, Clovis Torres)"
6579292885078121,4042024,Trabalho em Evento,Experimentos multidisciplinares para o Ensino da Computação no Curso de Sistemas de Informação,2014.0,Brasil,XXII - Workshop de Educação e Informática - WEI/CSBC 2014,Brasilia,,,,"Karla Donato Fook (FOOK, Karla Donato), Eveline de Jesus Viana Sá (SÁ, E. J. V.), Mauro Lopes Carvalho Silva (Silva, M. L. C.), Carla Gomes de Faria (Faria, C. G.)"
6579292885078121,4042024,Trabalho em Evento,An Automatic Code Generator for Parallel Evolutionary Algorithms: Achieving Speedup and Reducing The Programming Efforts.,2015.0,França,The Ninth International Conference on Advanced Engineering Computing and Applications in Sciences,Nice,,,,"Omar Andreas Carmona Cortes (CORTES, O. A. C.), Jeferson A Silva (SILVA, J. A.), Eveline de Jesus Viana Sá (SÁ, E. J. V.), A RAU-CHAPLIN (RAU-CHAPLIN, A.)"
6579292885078121,4042024,Trabalho em Evento,mecBRJogo: uma proposta de Mecanismo de Busca e Recuperação de Jogos Educacionais.,2014.0,Brasil,Sixth Brazilian Workshop on Semantic Web and Education (WSWEd?14@CBIE'14),Dourados - MS,,,,"jeane (TEIXEIRA, Jeane S. F), Eveline de Jesus Viana Sá (SÁ, E. J. V.), Clovis Torres Fernandes (FERNANDES, Clovis Torres)"
6579292885078121,4042024,Trabalho em Evento,Especificando Objeto de Aprendizagem para Raspberry Pi usando Design Instrucional,2015.0,Brasil,X Conferencia Latono-Americana de Objetos e Tecnologias de Aprendizagem (LACLO),Alagoas,,,,"Adryano Max Escorcio da Silva (Silva, A.M.E.), Eveline de Jesus Viana Sá (SÁ, E. J. V.), jeane (TEIXEIRA, Jeane S. F)"
6579292885078121,4042024,Trabalho em Evento,Autoria de Objeto de Aprendizagem com uso de Design Instrucional para Raspberry Pi,2015.0,Brasil,XII ENACOMP (Encontro Anual de Computação),Catalão,,,,"Adryano Max Escorcio da Silva (Silva, A.M.E.), Eveline de Jesus Viana Sá (SÁ, E. J. V.), jeane (TEIXEIRA, Jeane S. F)"
6579292885078121,4042024,Trabalho em Evento,Aprendizagem de Máquina para auxiliar na Pré-Autoria de Atividades de Aprendizagem Adaptáveis,2015.0,Brasil,XII ENACOMP (Encontro Anual de Computação),Catalão - GO,,,,"Ana Elisa da Luz Lavras (Lavras, A.E.L.), Eveline de Jesus Viana Sá (SÁ, E. J. V.), Josenildo  da Costa SIlva (SILVA, J. C.)"
6579292885078121,4042024,Trabalho em Evento,FORCA: Um editor de jogo educativo personalizável exportável como objeto de aprendizagem,2017.0,Brasil,XXVIII Simpósio Brasileiro de Informática na Educação  SBIE (Brazilian Symposium on Computers in Education),Recife,,,,"SILVA, LUIZ ARISTÓTELES SANTOS (SILVA, LUIZ ARISTÓTELES SANTOS), Eveline de Jesus Viana Sá (SÁ, EVELINE), NETO, JOSÉ NUNES DE OLIVEIRA (NETO, JOSÉ NUNES DE OLIVEIRA), FERREIRA, JEANE (FERREIRA, JEANE)"
6579292885078121,4042024,Trabalho em Evento,Ferramenta para edição de jogos didáticos por parametrização,2016.0,Brasil,Computer on the Beach,Florionopólis,,,,"Crystian F. R. Marinho (MARINHO, C. F. R.), Eveline de Jesus Viana Sá (SÁ, E. J. V.), jeane (TEIXEIRA, Jeane S. F)"
6579292885078121,4042024,Trabalho em Evento,Uma análise de Algoritmos de Enxame para colaboração em Sistemas de Autoria Inteligente,2017.0,Brasil,XXVIII Simpósio Brasileiro de Informática na Educação  SBIE (Brazilian Symposium on Computers in Education),Recife,,,,"LIMA, ARTHUR (LIMA, ARTHUR), CALDAS, FELIPE (CALDAS, FELIPE), Eveline de Jesus Viana Sá (SÁ, EVELINE), CORTES, OMAR (CORTES, OMAR), VIEIRA, DARIO (VIEIRA, DARIO)"
6579292885078121,4042024,Trabalho em Evento,Autoria de Atividades de Aprendizagem Adaptativas com base na Inteligencia Coletiva,2017.0,Brasil,XXVIII Simpósio Brasileiro de Informática na Educação  SBIE (Brazilian Symposium on Computers in Education),Recife,,,,"BARRETO, ALAN (BARRETO, ALAN), Eveline de Jesus Viana Sá (SÁ, EVELINE), CORTES, OMAR (CORTES, OMAR), VIEIRA, DARIO (VIEIRA, DARIO)"
6579292885078121,4042024,Trabalho em Evento,APLICAÇÃO MÓVEL COLABORATIVA PARA DISSEMINAÇÃO DE SINAIS E INTEGRAÇÃO DA LÍNGUA BRASILEIRA DE SINAIS,2018.0,Brasil,III CINTEDI (III CONGRESSO INTERNACIONAL DE EDUCAÇÃO INCLUSIVA & III JORNADA CHILENA BRASILEIRA DE EDUCAÇÃO INCLUSIVA E DIREITOS HUMANOS),Campina Grande,,,,"Erika Patrícia Martins Ferreira (FERREIRA, E. P. M.), Crysthian Fhylipe Ribeiro Marinho (MARINHO, C. F. R.), Eveline de Jesus Viana Sá (SÁ, E. J. V.)"
6579292885078121,4042024,Trabalho em Evento,Especificando orientações para desenvolvimento de interfaces para o idoso,2018.0,Brasil,Computer on the Beach 2018,,,,,"Ana Rebeca Marques Araujo (ARAUJO, A. R. M.), Eveline de Jesus Viana Sá (SÁ, E. J. V.), Karla Donato Fook (FOOK, Karla Donato)"
6579292885078121,4042024,Trabalho em Evento,É TEMPO DE APRENDER: CRIAÇÃO DE OBJETO DE APRENDIZAGEM PARA ALFABETIZAÇÃO DE JOVENS E ADULTOS DO CAMPO,2018.0,Brasil,III Simpósio Nacional de Tecnologias Digitais na Educação.,São Luis,,,,"Paula Francineti Ribeiro de Araujo (ARAUJO, P. F. R.), Eveline de Jesus Viana Sá (SÁ, E. J. V.), Ivana Márcia Oliveira Maia (MAIA, I. M. O.), Emanoel Lucas Moraes da Luz (LUZ, E. L. M.), Emanuel Lindoso Ferreira (FERREIRA, E. L.), Jordan Silva Barros (BARROS, J. S.)"
6579292885078121,4042024,Trabalho em Evento,LogEasy++: Uma ferramenta para ensino e aprendizagem personalizável utilizando Gamificação,2018.0,Brasil,XXIX Simpósio Brasileiro de Informática na Educação (Brazilian Symposium on Computers in Education),Fortaleza,,,,"CORREIA, KELLY SUENNY MARTINS (CORREIA, KELLY SUENNY MARTINS), Fook, Karla (Fook, Karla), Eveline de Jesus Viana Sá (SÁ, EVELINE)"
6579292885078121,4042024,Trabalho em Evento,Is there time for Software Testing in the Indie Games Development?,2019.0,Brasil,the XXXIII Brazilian Symposium,Salvador,,,,"DE OLIVEIRA NETO, JOSÉ NUNES (DE OLIVEIRA NETO, JOSÉ NUNES), VIANA, DAVI (VIANA, DAVI), Eveline de Jesus Viana Sá (SÁ, EVELINE), RIVERO, LUIS (RIVERO, LUIS), LOPES, RAFAEL FERNANDES (LOPES, RAFAEL FERNANDES), SILVA, FRANCISCO (SILVA, FRANCISCO)"
6579292885078121,4042024,Trabalho em Evento,Developing Computational Thought in Mathematics through Educational Robotics in Basic Education: A practical research analysis,2022.0,Romênia,2022 International Conference on Advanced Learning Technologies (ICALT),Bucharest,,,,"OLIVEIRA, JANAINA FONSECA (OLIVEIRA, JANAINA FONSECA), QUARTO, CICERO COSTA (QUARTO, CICERO COSTA), SILVA DOS SANTOS, ANDRE LUIS (SILVA DOS SANTOS, ANDRE LUIS), BELFORT, IRAN CHARLES PEREIRA (BELFORT, IRAN CHARLES PEREIRA), Eveline de Jesus Viana Sá (DE JESUS VIANA SA, EVELINE), SANTOS, JHONNY ROBERT SOUSA (SANTOS, JHONNY ROBERT SOUSA)"
6579292885078121,4042024,Trabalho em Evento,A inserção da Inovação Aberta nas Instituições de Pesquisa e nas Empresas: um diagnóstico do cenário Brasileiro,2022.0,Brasil,"Escola Regional de Computação do Ceará, Maranhão e Piauí",Brasil,,,,"REIS, APOEMA MENDES S. DOS (REIS, APOEMA MENDES S. DOS), Eveline de Jesus Viana Sá (Sá, Eveline de Jesus Viana), JACOB JUNIOR, ANTÔNIO LAVAREDA (JACOB JUNIOR, ANTÔNIO LAVAREDA), GOMES JÚNIOR, DANIEL LIMA (GOMES JÚNIOR, DANIEL LIMA)"
6579292885078121,4042024,Trabalho em Evento,Proposta de um Método de Ensino do Pensamento Computacional para a Educação Básica: um estudo de caso com base no Sistema Lesson,2022.0,Brasil,Simpósio Brasileiro de Informática na Educação,Brasil,,,,"SANTOS, JHONNY R. S. (SANTOS, JHONNY R. S.), OLIVEIRA, JANAINA F. (OLIVEIRA, JANAINA F.), QUARTO, CÍCERO COSTA (QUARTO, CÍCERO COSTA), JACOB JUNIOR, ANTONIO F. L. (JACOB JUNIOR, ANTONIO F. L.), Eveline de Jesus Viana Sá (SÁ, EVELINE J. V.)"
6579292885078121,4042024,Trabalho em Evento,Handling out of vocabulary words at the semantical level using recurrent neural networks.,2022.0,Brasil,"IEEE/WIC/ACM International Conference on Web Intelligence and Intelligent Agent Technology,","Niagara Falls, Canada.",,,,"Paula Miriam L. Pedroso (PEDROSO, P. M. L.), Eveline de Jesus Viana Sá (SÁ, E. J. V.), Fabio Manoel Fonseca Lobato (LOBATO, F. M. F.), Antônio Fernando Lavareda Jacob Junior (JACOB JUNIOR, A. F. L.)"
6579292885078121,4042024,Trabalho em Evento,Business Process Management (BPM) as an Alternative for Promotion of Knowledge Management (KM),2015.0,Portugal,XXI International Conference on Industrial Engineering and Operations Management,Aveiro,,,,"Marcos Matos (Matos, M.), Eveline de Jesus Viana Sá (SÁ, E. J. V.), Reinaldo de Jesus Silva (Silva, R. J.)"
7901813667971809,24042024,Trabalho em Evento,Fônons Localizados em Superfícies de Baixos Índices de Miller de Metais FCC,2003.0,Brasil,XXI Encontro de Físicos do Norte e Nordeste,Fortaleza,,,,"Fabio Henrique Silva Sales (Sales, F. H. S.), Artur da Silava Carriço (CARRIÇO, Artur da Silava)"
7901813667971809,24042024,Trabalho em Evento,Sinal Fotoacústico em Semicondutores,1993.0,Brasil,XI Encontro de Físicos do Norte e Nordeste,João Pessoa,,,,"Fabio Henrique Silva Sales (Sales, F. H. S.), Antônio Pinto Neto (PINTO NETO, Antônio)"
7901813667971809,24042024,Trabalho em Evento,Excitações em Superfícies Vicinais,2001.0,Brasil,III Escola Barsileira de Magnetismo Jorge André Swieca,Porto Alegre,,,,"Fabio Henrique Silva Sales (Sales, F. H. S.), Melquisedec L Silva (SILVA, Melquisedec L), Artur da Silva Carriço (CARRIÇO, Artur da Silva)"
7901813667971809,24042024,Trabalho em Evento,Dipolar Effects in The Coalescence of Lamellar Phases,2002.0,Brasil,XXV Encontro Nacional de Física da Matéria Condensada,Caxambu-MG,,,,"Fabio Henrique Silva Sales (Sales, F. H. S.)"
7901813667971809,24042024,Trabalho em Evento,Influências do SiO2 e do Bi2O3 nas Propriedades Elétricas do BaTiO3,1997.0,Brasil,XV Encontro de Físicos do Norte e Nordeste,Natal-RN,,,,"Fabio Henrique Silva Sales (Sales, F. H. S.), Gilcarlos Ribeiro de Medeiros (MEDEIROS, Gilcarlos Ribeiro de), Thomas Dumelow (DUMELOW, Thomas), Wilson Acchar (ACCHAR, Wilson), José Alzamir Pereira da Costa (COSTA, José Alzamir Pereira da)"
7901813667971809,24042024,Trabalho em Evento,Propriedades Físicas (Elétricas) em Amostras Semicondutoras,1996.0,Brasil,XIV Encontro de Físicos do Norte e Nordeste,Aracaju-Se,,,,"Fabio Henrique Silva Sales (Sales, F. H. S.), José Alzamir Pereira da Costa (COSTA, José Alzamir Pereira da)"
7901813667971809,24042024,Trabalho em Evento,Estudos da Condutividade Elétrica em Compostos de BaTiO3,1997.0,Brasil,XX Encontro Nacional de Física da Matéria Condensada,Caxambu-MG,,,,"Fabio Henrique Silva Sales (Sales, F. H. S.), José Alzamir Pereira da Costa (COSTA, José Alzamir Pereira da), Wilson Acchar (ACCHAR, Wilson), Thomas Dumelow (DUMELOW, Thomas)"
7901813667971809,24042024,Trabalho em Evento,Local Modes of Vicinal Surfaces,2000.0,Brasil,XVIII Encontro de Físicos do Norte e Nordeste,João Pessoa-PB,,,,"Fabio Henrique Silva Sales (Sales, F. H. S.), Artur da Silva Carriço (CARRIÇO, Artur da Silva), Ana Lúcia Dantas (DANTAS, Ana Lúcia), Vamberto D Mello (MELLO, Vamberto D)"
7901813667971809,24042024,Trabalho em Evento,Estudo Experimental Do Exercício Físico na Água em Camundongos Submetidos À Lesão Por,2007.0,Brasil,X Congresso Nacional de Cirurgia Experimental,Cuiabá,,,,"Tiago de Alencar Maia Pacheco (PACHECO, Tiago de Alencar Maia), Fabio Henrique Silva Sales (Sales, F. H. S.), Alexandre Luiz Albuquerque Pereira (PEREIRA, Alexandre Luiz Albuquerque)"
7901813667971809,24042024,Trabalho em Evento,INFLUÊNCIA DO CAMPO MAGNÉTICO NO CRESCIMENTO DE VEGETAIS,2007.0,Brasil,II Jornada Nacional da Produção Científica em Educação Profissional e Tecnológica,São Luis,,,,"Fabio Henrique Silva Sales (Sales, F. H. S.)"
7901813667971809,24042024,Trabalho em Evento,CONSUMO DE ENERGIA ELÉTRICA EM RESIDÊNCIAS DA GRANDE SÃO LUÍS DO MARANHÃO,2007.0,Brasil,II Jornada Nacional da Produção Científica em Educação Profissional e Tecnológica,São Luís,,,,"Fabio Henrique Silva Sales (Sales, F. H. S.)"
7901813667971809,24042024,Trabalho em Evento,EXPERIMENTOTECA DE FÍSICA FEITA DE MATERIAL RECICLÁVEL E ALTERNATIVO PARA O ENSINO MÉDIO,2007.0,Brasil,II Jornada Nacional da Produção Científica em Educação Profissional e Tecnológica,São Luis,,,,"Fabio Henrique Silva Sales (Sales, F. H. S.)"
7901813667971809,24042024,Trabalho em Evento,Cientistas do Amanhã,2008.0,Brasil,III Congresso de Pesquisa e Inovação Tecnológica da Rede Norte Nordeste de Educação Tecnológica,Fortaleza,,,,"Odaléia Alves Costa (COSTA, O. A.), Fabio Henrique Silva Sales (Sales, F. H. S.), Alfredo Costa Oliveira Junior (COSTA JUNIOR, A. C.), Allas Jony da Silva Oliveira (OLIVEIRA, A. J. S.)"
7901813667971809,24042024,Trabalho em Evento,Fluidos Magnéticos,2008.0,Brasil,III Congresso de Pesquisa e Inovação Tecnológica da Rede Norte Nordeste de Educação Tecnológica,Fortaleza,,,,"Fabio Henrique Silva Sales (Sales, F. H. S.), Fabiano de C Simas (SIMAS, F. C.), Celly S Correa (CORREA, C. S.), Andre Hadad Cortez (CORTEZ, A. H.), Magno E Teixeira (TEIXEIRA, M. E.), Paulo R de M Sousa (SOUSA, P. R. M.)"
7901813667971809,24042024,Trabalho em Evento,ESTUDO ESPERIMENTAL DO EXERCÍCIO FÍSICO NA ÁGUA EM CAMUNDONGOS SUBMETIDOS À LESÃO POR ESMAGAMENTO DO NERVO CIÁTICO,2007.0,Brasil,II Reunião Regional da Federação de Sociedades de Biologia Experimental,Recife-PE,,,,"T. A. M. Pacheco (PACHECO, T. A. M.), Fabio Henrique Silva Sales (Sales, F. H. S.), A. L. A. Pereira (PEREIRA, A. L. A.)"
7901813667971809,24042024,Trabalho em Evento,Fluidos Magnéticos,2008.0,Brasil,60 Reunião Anual da SBPC,Campinas,,,,"Fabio Henrique Silva Sales (Sales, F. H. S.), Celly S Correa (CORREA, C. S.), Fabiano de C Simas (SIMAS, F. C.), Luis Fernando Lopes Silva (SILVA, L. F. L.), Andre Hadad Cortez (CORTEZ, A. H.), Paulo R de M Sousa (SOUSA, P. R. M.)"
7901813667971809,24042024,Trabalho em Evento,Consumo de Energia Elétrica em Residências da Grande São luis do Maranhão,2008.0,Brasil,60 Reunião Anual da SBPC,Campinas,,,,"Fabio Henrique Silva Sales (Sales, F. H. S.), Danielle L Loiola (LOIOLA, D. L.), José Amauri dos S  Ferreira (FERREIRA, J. A. S.), Maria  Graça (GRACA, M.), Marcos Rogério L  Araújo (ARAUJO, M. R. L.), Helenilde dos S Ferreira (FERREIRA, H. S.)"
7901813667971809,24042024,Trabalho em Evento,EXPERIMENTOTECA DE FÍSICA FEITA DE MATERIAL RECICLÁVEL E ALTERNATIVO PARA O ENSINO MÉDIO: O CASO DO CEFET-MA,2008.0,Brasil,60 Reunião Anual da SBPC,Campinas-SP,,,,"Fabio Henrique Silva Sales (Sales, F. H. S.), Luciana R S Pontes (PONTES, L. R. S.), Raisa Marya Souza de Oliveira (OLIVEIRA, R. M. S.)"
7901813667971809,24042024,Trabalho em Evento,Medidas Elétricas em Frutas e Legumes,2008.0,Brasil,60 Reunião Anual da SBPC,Campinas,,,,"Fabio Henrique Silva Sales (Sales, F. H. S.), Washington Lemos Pereira (PEREIRA, W. L.), Luis Fernando Lopes Silva (SILVA, L. F. L.), Wilton Ferreira Borges (BORGES, W. F.)"
7901813667971809,24042024,Trabalho em Evento,A influência do campo magnético na germinaçáo de vegetais,2008.0,Brasil,16 SBPC JOVEM,Campinas-SP,,,,"Fabio Henrique Silva Sales (Sales, F. H. S.), Dayanna G Santos (SANTOS, D. G.), Luana Lopes Padilha (PADILHA, L. L.), Michelle Santos rose Almeida (ALMEIDA, Michelle Santos Rose)"
7901813667971809,24042024,Trabalho em Evento,Fluidos Magnéticos,2008.0,Brasil,60 Reunião Anual da Sociedade Brasileira para o Progresso da Ciência,Campinas,,,,"Fabio Henrique Silva Sales (Sales, F. H. S.), Celly S Correa (CORREA, C. S.), Luis Fernando Lopes Silva (SILVA, L. F. L.), Andre Hadad Cortez (CORTEZ, A. H.), Paulo R de M Sousa (SOUSA, P. R. M.), Fabiano de C Simas (SIMAS, F. C.)"
7901813667971809,24042024,Trabalho em Evento,Fluidos Magnéticos,2008.0,Brasil,III CONNEPI,Fortaleza,,,,"Fabio Henrique Silva Sales (Sales, F. H. S.), Celly S Correa (CORREA, C. S.), Andre Hadad Cortez (CORTEZ, A. H.), Luis Fernando Lopes Silva (SILVA, L. F. L.), Fabiano de C Simas (SIMAS, F. C.), Magno E Teixeira (TEIXEIRA, M. E.)"
7901813667971809,24042024,Trabalho em Evento,Fluidos Magnéticos,2008.0,Brasil,I Feira de Ciências e Tecnologia do Sul do Maranhão - I FECITEC,Imperatriz,,,,"Fabio Henrique Silva Sales (Sales, F. H. S.)"
7901813667971809,24042024,Trabalho em Evento,Consumo de Energia Elétrica em Residências da Grande São luis do Maranhão,2008.0,Brasil,XXVI EFNNE,Recife,,,,"Fabio Henrique Silva Sales (Sales, F. H. S.), Danielle L Loiola (LOIOLA, D. L.), Helenilde dos S Ferreira (FERREIRA, H. S.), Maria  Graça (GRACA, M.)"
7901813667971809,24042024,Trabalho em Evento,O desafio do ensino de física através da arte: uma proposta pedagógica alternativa para alunos cidadãos.,2008.0,Brasil,XXVI EFNNE,Recife,,,,"Fabio Henrique Silva Sales (Sales, F. H. S.), Ramony de Oliveira Barbosa (BARBOSA, R. O.)"
7901813667971809,24042024,Trabalho em Evento,Surface spin slips in thin Dy films,2009.0,Brasil,11th International conference on advanced materials,Rio de Janeiro,,,,"Fabio Henrique Silva Sales (Sales, F. H. S.), Artur da Silva Carriço (CARRIÇO, Artur da Silva), Ana Lúcia Dantas (DANTAS, Ana Lúcia), Vamberto D Mello (MELLO, Vamberto D)"
7901813667971809,24042024,Trabalho em Evento,A computação algébrica como ferramenta de ensino de física no nível médio,2007.0,Brasil,"II Jornada Nacional da Produção Científica em Educação Profissional e Tecnológica, 2007",São Luis-MA,,,,"MARTINS, G. V. (MARTINS, G. V.), SOARES, W. J. F. (SOARES, W. J. F.), TAVARES, J. A. S. (TAVARES, J. A. S.), GOMES, A. R. (GOMES, A. R.), MAIA, R. L. M. (MAIA, R. L. M.), F. A. Miranda Filho (F. A. Miranda Filho), V. B. Marques (V. B. Marques), Fabio Henrique Silva Sales (Sales, F. H. S.), P. R. Ribeiro (P. R. Ribeiro)"
7901813667971809,24042024,Trabalho em Evento,Histerese Térmica Magnética em Nanocamadas de Disprósio,2010.0,Brasil,62a. Reunião Anual da SBPC,Natal-RN,,,,"Fabio Henrique Silva Sales (Sales, F. H. S.), Dantas, Ana L. (Dantas, Ana L.), Ajani Ross (Ajani Ross), Ali Koymen (Ali Koymen), Artur da Silva Carriço (CARRIÇO, Artur da Silva)"
7901813667971809,24042024,Trabalho em Evento,Grupo de Magnetismo e Materiais Magnéticos,2010.0,Brasil,XVI CIENTEC,Natal-RN,,,,"Fabio Henrique Silva Sales (Sales, F. H. S.), Artur da Silva Carriço (CARRIÇO, Artur da Silva), Ana Lúcia Dantas (DANTAS, Ana Lúcia), Vamberto D Mello (MELLO, Vamberto D), Ali Koymen (Ali Koymen), Ajani Ross (Ajani Ross)"
7901813667971809,24042024,Trabalho em Evento,Giant Magnetocaloric Effect of Thin Ho Films,2010.0,Brasil,55a. MMM 2010,Atlanta - Georgia (EUA),,,,"F. C. Medeiros Filho (F. C. Medeiros Filho), Vamberto D Mello (MELLO, Vamberto D), Ana Lúcia Dantas (DANTAS, Ana Lúcia), Fabio Henrique Silva Sales (Sales, F. H. S.), Artur da Silva Carriço (CARRIÇO, Artur da Silva)"
7901813667971809,24042024,Trabalho em Evento,A Influência do Campo Magnético na Germinação de Sementes de Alface (Lactuca Sativa).,2010.0,Brasil,XXVIII Encontro de Físicos do Norte e Nordeste,Tersina - PI,,,,"Joelma M. N. Pereira (Pereira,J.M.N.), Ivanilson Sousa  da Costa (COSTA, I. S.), joaquim Teixeira Lopes (Lopes, Joaquim T.), Fabio Henrique Silva Sales (Sales, F. H. S.)"
7901813667971809,24042024,Trabalho em Evento,Spin Slips de Superfície em Filmes Finos de Hólmio,2010.0,Brasil,XXVIII Encontro de Físicos do Norte e Nordeste,Tersina - PI,,,,"Fabio Henrique Silva Sales (Sales, F. H. S.), F. C. Medeiros Filho (F. C. Medeiros Filho), Vamberto D Mello (MELLO, Vamberto D), Ana Lúcia Dantas (DANTAS, Ana Lúcia), Artur da Silva Carriço (CARRIÇO, Artur da Silva)"
7901813667971809,24042024,Trabalho em Evento,A INFLUÊNCIA DOS EFEITOS SONOROS NA BIBLIOTECA DE UMA ESCOLA PÚBLICA DE SÃO LUÍS-MA,2011.0,Brasil,63a Reunião Anual da Sociedade para o Progresso da Ciência,Goiânia-GO,,,,"Carlos Augusto Santos Pereira (Pereira, A. S. P.), Leila Cristiane Souza e Silva (Silva, L. C. S.), Fabio Henrique Silva Sales (Sales, F. H. S.)"
7901813667971809,24042024,Trabalho em Evento,EFEITOS DE CAMPO MAGNÉTICO NA GERMINAÇÃO DE SEMENTES DE ALFACE (Lactuca Sativa).,2011.0,Brasil,63a Reunião Anual da Sociedade para o Progresso da Ciência,Goiânia-GO,,,,"Ivanilson Sousa  da Costa (COSTA, I. S.), Michelle Santos rose Almeida (ALMEIDA, Michelle Santos Rose), joaquim Teixeira Lopes (Lopes, Joaquim T.), Fabio Henrique Silva Sales (Sales, F. H. S.)"
7901813667971809,24042024,Trabalho em Evento,Surface spin slips in thin holmium films,2011.0,Brasil,56TH Annual Conference on Magnetism and Magnetic Materials,"Scottsdale, AZ",,,,"Fabio Henrique Silva Sales (Sales, F. H. S.), Dantas, A. L. (Dantas, A. L.), Carriço, A. S. (Carriço, A. S.)"
7901813667971809,24042024,Trabalho em Evento,Fases Magnéticas Spin Slips em Filmes Finos de Hólmio,2011.0,Brasil,II Mostra Científica da FAPEMA,São Luís-MA,,,,"Fabio Henrique Silva Sales (Sales, F. H. S.), Dantas, A. L. (Dantas, A. L.), Carriço, A. S. (Carriço, A. S.)"
7901813667971809,24042024,Trabalho em Evento,Análise do Conforto Acústico em Biblioteca Escolar Pública,2011.0,Brasil,II Mostra Científica da FAPEMA,São Luís-MA,,,,"Leila Cristiane Souza e Silva (Silva, L. C. S.), Carlos Augusto S Pereira (PEREIRA, C. A. S.), Fabio Henrique Silva Sales (Sales, F. H. S.)"
