numero_identificador,data_atualizacao,tipo,titulo,ano,pais,evento,cidade,periodico,editora,descricao,autores
3810732989135120,16042024,Trabalho em Evento,Produção de biodiesel a partir do óleo de babaçu utilizando misturas dos álcoois metanol-etanol,2006.0,Brasil,XLVI Congresso Brasileiro de Química,Salvador-BA,,,,"Kiany Sirley Brandão Cavalcante (CAVALCANTE, K. S. B.), Ulisses Magalhaes Nascimento (NASCIMENTO, U. M.), Maurício Cardoso Sousa (SOUSA, M. C.), Hilton Costa Louzeuiro (LOUZEUIRO, H. C.), Fernando Carvalho Silva (SILVA, Fernando Carvalho)"
3810732989135120,16042024,Trabalho em Evento,Otimização do processo de separação da glicerina do biodiesel etílico obtido pela transesterificação do óleo de babaçu,2007.0,Brasil,I Congresso Internacional de Agroenergia e Biocombustíveis,Teresina-PI,,,,"Kiany Sirley Brandão Cavalcante (CAVALCANTE, K. S. B.), Marcelle Silva de Jesus (JESUS, M. S. de), Adeilton Preira Maciel (MACIEL, A. P.), Victor Elias Mouchrek Filho (MOUCHREK FILHO, V. E.), Fernando Carvalho Silva (SILVA, Fernando Carvalho)"
3810732989135120,16042024,Trabalho em Evento,Otimização das condições da reação de transesterificação do biodiesel metílico de babaçu por análise fatorial,2007.0,Brasil,I Congresso Internacional de Agroenergia e Biocombustíveis,Teresina-PI,,,,"Kiany Sirley Brandão Cavalcante (CAVALCANTE, K. S. B.), Joselene R. de Jesus Santos (SANTOS, J. R. J.), Antônio Gouveia Souza (SOUZA, A. G.), Nataly A. Santos (SANTOS, N. A.), Fernando Carvalho Silva (SILVA, Fernando Carvalho)"
3810732989135120,16042024,Trabalho em Evento,Estudo e otimização do processo de produção de biodiesel etílico de óleo de mamona (Ricinus Communis L.),2007.0,Brasil,I Congresso Internacional de Agroenergia e Biocombustíveis,Teresina-PI,,,,"Kiany Sirley Brandão Cavalcante (CAVALCANTE, K. S. B.), Karlene Kelen Marques Mendonça (MENDONCA, K. K. M.), Maria da Natividade Chagas Penha (PENHA, M. N. C.), Adeilton Preira Maciel (MACIEL, A. P.), Antônio Gouveia Souza (SOUZA, A. G.), Fernando Carvalho Silva (SILVA, Fernando Carvalho)"
3810732989135120,16042024,Trabalho em Evento,Avaliação das propriedades fisico-químicas e estabilidade térmica do óleo e do biodiesel metílico de pequi (Caryocar Coriaceum Seed Oil),2007.0,Brasil,I Congresso Internacional de Agroenergia e Biocombustíveis,Teresina-PI,,,,"Kiany Sirley Brandão Cavalcante (CAVALCANTE, K. S. B.), Adeilton Preira Maciel (MACIEL, A. P.), Hilton Costa Louzeiro (LOUZEIRO, Hilton Costa), Hilton Costa Louzeuiro (LOUZEUIRO, H. C.), Ulisses Magalhaes Nascimento (NASCIMENTO, U. M.), Antônio Gouveia Souza (SOUZA, A. G.), Fernando Carvalho Silva (SILVA, Fernando Carvalho)"
3810732989135120,16042024,Trabalho em Evento,Avaliação da estabilidade térmica do óleo de junça (Cyperus esculentus),2006.0,Brasil,V Congresso Brasileiro de Análise Térmica e Calorimetria,Poços de Calda-MG,,,,"Kiany Sirley Brandão Cavalcante (CAVALCANTE, K. S. B.), Ulisses Magalhaes Nascimento (NASCIMENTO, U. M.), Fernando Carvalho Silva (SILVA, Fernando Carvalho), Antônio Gouveia Souza (SOUZA, A. G.), Marta Maria da Conceição (CONCEIÇÃO, M. M. da)"
3810732989135120,16042024,Trabalho em Evento,Avaliação da estabilidade térmica do óleo de pequi (Caryocar coriaceum seed oil),2006.0,Brasil,V Congresso Brasileiro de Análise Térmica e Calorimetria,Poços de Calda-MG,,,,"Kiany Sirley Brandão Cavalcante (CAVALCANTE, K. S. B.), Ulisses Magalhaes Nascimento (NASCIMENTO, U. M.), Fernando Carvalho Silva (SILVA, Fernando Carvalho), Antônio Gouveia Souza (SOUZA, A. G.), Marta Maria da Conceição (CONCEIÇÃO, M. M. da)"
3810732989135120,16042024,Trabalho em Evento,Caracterização fisico-química e térmica do biodiesel metílico de pequi (Caryocar coriaceum seed oil),2006.0,Brasil,V Congresso Brasileiro de Análise Térmica e Calorimetria,Poços de Calda-MG,,,,"Kiany Sirley Brandão Cavalcante (CAVALCANTE, K. S. B.), Ulisses Magalhaes Nascimento (NASCIMENTO, U. M.), Fernando Carvalho Silva (SILVA, Fernando Carvalho), Antônio Gouveia Souza (SOUZA, A. G.), Marta Maria da Conceição (CONCEIÇÃO, M. M. da)"
3810732989135120,16042024,Trabalho em Evento,Avaliação das propriedades fisico-quimicas e estabilidade térmica do biodiesel metílico de junça,2006.0,Brasil,V Congresso Brasileiro de Análise Térmica e Calorimetria,Poços de Calda-MG,,,,"Kiany Sirley Brandão Cavalcante (CAVALCANTE, K. S. B.), Ulisses Magalhaes Nascimento (NASCIMENTO, U. M.), Fernando Carvalho Silva (SILVA, Fernando Carvalho), Antônio Gouveia Souza (SOUZA, A. G.), Marta Maria da Conceição (CONCEIÇÃO, M. M. da)"
3810732989135120,16042024,Trabalho em Evento,Avaliação da estabilidade térmica do biodiesel metílico obtido do sebo bovino,2006.0,Brasil,V Congresso Brasileiro de Análise Térmica e Calorimetria,Poços de Calda-MG,,,,"Kiany Sirley Brandão Cavalcante (CAVALCANTE, K. S. B.), Kátia Marques Moura (MOURA, K. M.), Fernando Carvalho Silva (SILVA, Fernando Carvalho), Antônio Gouveia Souza (SOUZA, A. G.), Marta Maria da Conceição (CONCEIÇÃO, M. M. da)"
3810732989135120,16042024,Trabalho em Evento,Estudo das propriedades fisico-químicas e avaliação da estabilidade térmica do sebo bovino,2006.0,Brasil,V Congresso Brasileiro de Análise Térmica e Calorimetria,Poços de Calda-MG,,,,"Kiany Sirley Brandão Cavalcante (CAVALCANTE, K. S. B.), Kátia Marques Moura (MOURA, K. M.), Fernando Carvalho Silva (SILVA, Fernando Carvalho), Antônio Gouveia Souza (SOUZA, A. G.), Marta Maria da Conceição (CONCEIÇÃO, M. M. da)"
3810732989135120,16042024,Trabalho em Evento,Estudo e otimização do processo de produção de biodiesel etílico em escala de laboratório obtido pela transesterificação do óleo de soja (Glicine sp),2004.0,Brasil,I Congresso de ensino pesquisa e extensão da UFMA,São Luis-MA,,,,"Kiany Sirley Brandão Cavalcante (CAVALCANTE, K. S. B.), Gisele Simone Lopes (LOPES, G. S.)"
3810732989135120,16042024,Trabalho em Evento,Produção de biodiesel metílico pela reação de transesterificação do óleo de babaçu (Orbignya martiana) refinado e bruto,2005.0,Brasil,XXIV Encontro Nacional dos Estudantes de Química,São Luís-MA,,,,"Kiany Sirley Brandão Cavalcante (CAVALCANTE, K. S. B.), Tamara Samara L Cavalcante (CAVALCANTE, T. S. L.), Adilton Costa Alves (ALVES, Adilton Costa), Ronald de Jesus Rezzo Pires (PIRES, Ronald de Jesus Rezzo), Hilton Costa Louzeuiro (LOUZEUIRO, H. C.), Fernando Carvalho Silva (SILVA, Fernando Carvalho), Gisele Simone Lopes (LOPES, G. S.), Henrique Tadeu Castro Cardias (CARDIAS, Henrique Tadeu Castro)"
3810732989135120,16042024,Trabalho em Evento,Microextração em fase sólida (MEFS): uma alternativa para a extração de BTEX em gasolina,2005.0,Brasil,XXIV Encontro Nacional dos Estudantes de Química,São Luis-MA,,,,"Kiany Sirley Brandão Cavalcante (CAVALCANTE, K. S. B.), Hilton Costa Louzeuiro (LOUZEUIRO, H. C.), Fernando Carvalho Silva (SILVA, Fernando Carvalho), Cicero Wellington Brito Bezerra (BEZERRA, C. W. B.)"
3810732989135120,16042024,Trabalho em Evento,Estudo do processo de produção do biodiesel etílico de babaçu utilizando NaOH como catalisador,2005.0,Brasil,XXIV Encontro Nacional dos Estudantes de Química,São Luis-MA,,,,"Kiany Sirley Brandão Cavalcante (CAVALCANTE, K. S. B.), Tamara Samara L Cavalcante (CAVALCANTE, T. S. L.), Adilton Costa Alves (ALVES, Adilton Costa), Caio Kawaoka Melo (MELO, C. K.), Fernando Carvalho Silva (SILVA, Fernando Carvalho), Henrique Tadeu Castro Cardias (CARDIAS, Henrique Tadeu Castro)"
3810732989135120,16042024,Trabalho em Evento,Produção de biodiesel a partir de óleos residuais de fritura usados por empresas instalada na ilha de São Luis,2005.0,Brasil,XXIV Encontro Nacional dos Estudantes de Química,São Luis-MA,,,,"Kiany Sirley Brandão Cavalcante (CAVALCANTE, K. S. B.), Adilton Costa Alves (ALVES, Adilton Costa), Caio Kawaoka Melo (MELO, C. K.), Ronald de Jesus Rezzo Pires (PIRES, Ronald de Jesus Rezzo), Fernando Carvalho Silva (SILVA, Fernando Carvalho), Henrique Tadeu Castro Cardias (CARDIAS, Henrique Tadeu Castro)"
3810732989135120,16042024,Trabalho em Evento,Extração e determinação de quitosana a partir da casca de carangueijo,2005.0,Brasil,XXIV Encontro Nacional dos Estudantes de Química,São Luis-MA,,,,"Kiany Sirley Brandão Cavalcante (CAVALCANTE, K. S. B.), Marcio Aurelio Pinheiro Almeida (ALMEIDA, M. A. P.), Fernando Carvalho Silva (SILVA, Fernando Carvalho), Henrique Tadeu Castro Cardias (CARDIAS, Henrique Tadeu Castro), Antônio E. Evangelista Junior (EVANGELISTA JUNIOR, A. E.)"
3810732989135120,16042024,Trabalho em Evento,Otimização do processo de purificação de biodiesel produzido a partir de óleo de babaçu,2005.0,Brasil,XLV Congresso Brasileiro de Química,Belém-PA,,,,"Kiany Sirley Brandão Cavalcante (CAVALCANTE, K. S. B.), Caio Kawaoka Melo (MELO, C. K.), Adilton Costa Alves (ALVES, Adilton Costa), Fernando Carvalho Silva (SILVA, Fernando Carvalho), Henrique Tadeu Castro Cardias (CARDIAS, Henrique Tadeu Castro)"
3810732989135120,16042024,Trabalho em Evento,Estudo das condições reacionais da produção de biodiesel a partir de óleos residuais de fritura de empresas instaladas na ilha de São Luis,2005.0,Brasil,57ª Reunião Anual da SBPC,Fortaleza-CE,,,,"Kiany Sirley Brandão Cavalcante (CAVALCANTE, K. S. B.), Ulisses Magalhaes Nascimento (NASCIMENTO, U. M.), Adilton Costa Alves (ALVES, Adilton Costa), Jacine de Jesus Freitas Cardoso (CARDOSO, J. de J. F.), Caio Kawaoka Melo (MELO, C. K.), Ronald de Jesus Rezzo Pires (PIRES, Ronald de Jesus Rezzo), Angela Maria Correa Mouzinho (MOUZINHO, Angela Maria Correa), Fernando Carvalho Silva (SILVA, Fernando Carvalho), Henrique Tadeu Castro Cardias (CARDIAS, Henrique Tadeu Castro)"
3810732989135120,16042024,Trabalho em Evento,Otimização das condições reacionais do processo de produção de biodiesel etílico a partir do óleo de babaçu (Orbignya martiana),2005.0,Brasil,XXIV Encontro dos Estudantes de Química,São Luis-MA,,,,"Kiany Sirley Brandão Cavalcante (CAVALCANTE, K. S. B.), Caio Kawaoka Melo (MELO, C. K.), Fabielly Barbosa Lacerda (LACERDA, Fabielly Barbosa), Adilton Costa Alves (ALVES, Adilton Costa), Tamara Samara L Cavalcante (CAVALCANTE, T. S. L.), Fernando Carvalho Silva (SILVA, Fernando Carvalho), Henrique Tadeu Castro Cardias (CARDIAS, Henrique Tadeu Castro)"
3810732989135120,16042024,Trabalho em Evento,Caracterização fisico-quimica da semente e óleo de pinhão manso (Jatropha Curcas),2007.0,Brasil,II Congresso da Rede Brasileira de Tecnologia de Biodiesel,Brasília,,,,"Kiany Sirley Brandão Cavalcante (CAVALCANTE, K. S. B.), Maria da Natividade Chagas Penha (PENHA, M. N. C.), Maia Dayana Penha da Silva (SILVA, .M. D. P. da), Karlene Kelen Marques Mendonça (MENDONCA, K. K. M.), Adeilton Preira Maciel (MACIEL, A. P.), Fernando Carvalho Silva (SILVA, Fernando Carvalho)"
3810732989135120,16042024,Trabalho em Evento,Desenvolvimento de um protótipo para determinar o teor de biodiesel no diesel por capacitância,2007.0,Brasil,II Congresso da Rede Brasileira de Tecnologia de Biodiesel,Brasília,,,,"Kiany Sirley Brandão Cavalcante (CAVALCANTE, K. S. B.), Antônio Carlos Sales Vasconcelos (VASCONCELOS, A. C. S.), Hipólito Calvacante Correia (CORREIA, H. C.), Jomar Sales Vasconcelos (VASCONCELOS, J. S.), Fernando Carvalho Silva (SILVA, Fernando Carvalho), Antônio Gouveia Souza (SOUZA, A. G.)"
3810732989135120,16042024,Trabalho em Evento,Aplicação do planejamento fatorial e metodologia de superfície de resposta na otimização da produção do biodiesel metílico de mamona,2007.0,Brasil,II Congresso da Rede Brasileira de Tecnologia de Biodiesel,Brasília,,,,"Kiany Sirley Brandão Cavalcante (CAVALCANTE, K. S. B.), Luzenir Monteiro Pinto (PINTO, L. M.), Adeilton Preira Maciel (MACIEL, A. P.), Antônio Gouveia Souza (SOUZA, A. G.), Fernando Carvalho Silva (SILVA, Fernando Carvalho)"
3810732989135120,16042024,Trabalho em Evento,Otimização da produção de biodiesel metílico de sebo bovino usando a metodologia de superfície de resposta,2007.0,Brasil,II Congresso da Rede Brasileira de Tecnologia de Biodiesel,Brasília,,,,"Kiany Sirley Brandão Cavalcante (CAVALCANTE, K. S. B.), Kátia Marques Moura (MOURA, K. M.), Adeilton Preira Maciel (MACIEL, A. P.), Fernando Carvalho Silva (SILVA, Fernando Carvalho), Antônio Gouveia Souza (SOUZA, A. G.)"
3810732989135120,16042024,Trabalho em Evento,Otimização da transesterificação etilica do óleo de mamona usando o Delineamento Composto Central Rotacional,2007.0,Brasil,II Congresso da Rede Brasileira de Tecnologia de Biodiesel,Brasília,,,,"Kiany Sirley Brandão Cavalcante (CAVALCANTE, K. S. B.), Maria da Natividade Chagas Penha (PENHA, M. N. C.), Karlene Kelen Marques Mendonça (MENDONCA, K. K. M.), Adeilton Preira Maciel (MACIEL, A. P.), Antônio Gouveia Souza (SOUZA, A. G.), Fernando Carvalho Silva (SILVA, Fernando Carvalho)"
3810732989135120,16042024,Trabalho em Evento,Aplicação da Metodologia de Superfície de Resposta na Otimização na Transesterificação Metílica do Óleo de Amendoim (Arachis hypogea),2008.0,Brasil,31ª Reunião Anual da Sociedade Brasileira de Química (SBQ),Águas de Lindóia,,,,"Kiany Sirley Brandão Cavalcante (CAVALCANTE, K. S. B.), Fernando Carvalho Silva (SILVA, Fernando Carvalho), Luzenir Monteiro Pinto (PINTO, L. M.), Antônio Carlos Sales Vasconcelos (VASCONCELOS, A. C. S.), Adeilton Preira Maciel (MACIEL, A. P.), Antônio Gouveia Souza (SOUZA, A. G.)"
3810732989135120,16042024,Trabalho em Evento,Métodos de Análise da Qualidade de Combustíveis e Blendas por Capacitância,2008.0,Brasil,31ª Reunião Anual da Sociedade Brasileira de Química (SBQ),Águas de Lindóia,,,,"Kiany Sirley Brandão Cavalcante (CAVALCANTE, K. S. B.), Fernando Carvalho Silva (SILVA, Fernando Carvalho), Adeilton Preira Maciel (MACIEL, A. P.), Jomar Sales Vasconcelos (VASCONCELOS, J. S.), Luzenir Monteiro Pinto (PINTO, L. M.), Antônio Gouveia Souza (SOUZA, A. G.), Antônio Carlos Sales Vasconcelos (VASCONCELOS, A. C. S.)"
3810732989135120,16042024,Trabalho em Evento,Monitoramento da qualidade fúngica do ar na biblioteca Tebyreça de Oliveira do IFMA,2011.0,Brasil,VI Congresso Norte e Nordeste de Pesquisa e Inovação Tecnológica - CONNEPI,Natal-RN,,,,"Kiany Sirley Brandão Cavalcante (CAVALCANTE, K. S. B.), Vivaldo Isac Ribeiro Almeida Júnior (ALMEIDA JUNIOR, V. I. R.), Rodrigo Césio Duarte Gondim (GONDIM, R. C. D.), Rogério de Mesquita Teles (TELES, R. M.), Gilda Maira Barreto (BARRETO, G. M.)"
3810732989135120,16042024,Trabalho em Evento,Atividade lúdica no ensino de EJA em Eletrotécnica: Modelos Atômicos e Tabela Periódica,2012.0,Brasil,VII Congresso Norte Nordeste de Pesquisa e Inovação - CONNEPI,Palmas-TO,,,,"Kiany Sirley Brandão Cavalcante (CAVALCANTE, K. S. B.), Aline Barbosa de Oliveira (OLIVEIRA, A. B.), Mali Raiol da Silva (SILVA, M. R.), Maria de Fátima Ribeiro Pavão (PAVAO, M. F. R.)"
3810732989135120,16042024,Trabalho em Evento,Qualidade do ar no ambiente interno e climatizados do restaurante central do IFMA campus Monte Castelo: uma avaliação microbiológica,2012.0,Brasil,VII Congresso Norte e Nordeste de Pesquisa e Inovação - CONNEPI,Palmas-TO,,,,"Kiany Sirley Brandão Cavalcante (CAVALCANTE, K. S. B.), Rodrigo Césio Duarte Gondim (GONDIM, R. C. D.), Rogério de Mesquita Teles (TELES, R. M.), Vivaldo Isac Ribeiro Almeida Júnior (ALMEIDA JUNIOR, V. I. R.), Carlos Henrique Melo Macêdo (MACEDO, C. H. M.)"
3810732989135120,16042024,Trabalho em Evento,Determinação de cloro em alvejantes por oxirredução: uma prática,2012.0,Brasil,XVI Encontro Nacional de Ensino de Química (XVI ENEQ) e X Encontro de Educação Química da Bahia (X Eduqui),Salvador-BA,,,,"Kiany Sirley Brandão Cavalcante (CAVALCANTE, K. S. B.), Francisco Flávio Pereira de Sousa (SOUSA, F. F. P.), Juliana Maria Mendonça (MENDONCA, J. M.), Eric Frederico da Costa Coelho (COELHO, E. F. C.), Ailton do Nascimento Araujo Costa (COSTA, A. N. A.)"
3810732989135120,16042024,Trabalho em Evento,Dominó orgânico: jogo lúdico como recurso pedagógico no ensino de Química Orgânica,2012.0,Brasil,64ª Reunião Anual da SBPC,São Luís-MA,,,,"Kiany Sirley Brandão Cavalcante (CAVALCANTE, K. S. B.), Glauciane Leal Dourado (DOURADO, G. L.), Cicero Wellington Brito Bezerra (BEZERRA, C. W. B.), José Alberto Pestana Chaves (CHAVES, J. A. P.)"
3810732989135120,16042024,Trabalho em Evento,"Biodiesel de Babaçu: avaliação térmica, oxidativa e misturas binárias com o óleo diesel",2012.0,Brasil,64ª Reunião Anual da SBPC,São Luís-MA,,,,"Joselene R. de Jesus Santos (SANTOS, J. R. J.), Kiany Sirley Brandão Cavalcante (CAVALCANTE, K. S. B.), Nataly Albuquerque dos Santos (SANTOS, N. A.), Antonio Gouveia Souza (SOUZA, A. G.)"
3810732989135120,16042024,Trabalho em Evento,Teatro Radioativo: uma metodologia de Ensino da Química no Curso de Eletrotécnica - EJA,2013.0,Brasil,65ª Reunião Anual da SBPC,Recife-PE,,,,"Kiany Sirley Brandão Cavalcante (CAVALCANTE, K. S. B.), Aline Barbosa de Oliveira (OLIVEIRA, A. B.), Mali Raiol da Silva (SILVA, M. R.), Maria de Fátima Ribeiro Pavão (PAVAO, M. F. R.)"
3810732989135120,16042024,Trabalho em Evento,Determinação Qualitativa do íon niquel em amostras metálicas niqueladas,2013.0,Brasil,53º Congresso Brasileiro de Química,Rio de Janeiro,,,,"Rayse Machado Ferreira (FERREIRA, R. M.), Thays Cristinne Campos Lavra (LAVRA, T. C. C.), Kiany Sirley Brandão Cavalcante (CAVALCANTE, K. S. B.), Nazaré do Socorro Lemos Silva Vasconcelos (VASCONCELOS, N. S. L. S.)"
3810732989135120,16042024,Trabalho em Evento,"Construindo um bafômetro: alternativa para o ensino de eletroquímica no curso técnico em eletrotécnica, modalidade EJA",2014.0,Brasil,I Encontro Nacional de Jogos e Atividades Lúdicas no Ensino de Química - JALEQUIM,Goiânia,,,,"Aline Barbosa de Oliveira (OLIVEIRA, A. B.), Mali Raiol da Silva (SILVA, M. R.), Kiany Sirley Brandão Cavalcante (CAVALCANTE, K. S. B.), Maria de Fátima Ribeiro Pavão (PAVAO, M. F. R.)"
3810732989135120,16042024,Trabalho em Evento,Estudo comparativo da produção de açúcares fermentáveis a partir da casca e entrecasca da macaxeira.,2015.0,Brasil,55º CBQ,Goiânia,,,,"Camila Maia Campelo (CAMPELO, C. M.), Kiany Sirley Brandão Cavalcante (CAVALCANTE, K. S. B.), Thaynara Ferreira Soares (SOARES, T. F.), Rayane Kelly Pereira Ribeiro (RIBEIRO, R. K. P.)"
3810732989135120,16042024,Trabalho em Evento,"Estudo de pré-tratamentos de casca de arroz e de macaxeira, como biomassas lignocelulósicas, visando sua bioconversão em etanol.",2015.0,Brasil,55º CBQ,Goiânia,,,,"Priscilla Fernanda Fernandes Rodrigues (RODRIGUES, P. F. F.), Camila Maia Campelo (CAMPELO, C. M.), Fernando C. Silva (SILVA, F.C.), Kiany Sirley Brandão Cavalcante (CAVALCANTE, K. S. B.)"
3810732989135120,16042024,Trabalho em Evento,A Química da vela: uma Abordagem Experimental Problematizadora no Ensino de Hidrocarbonetos,2015.0,Brasil,55º CBQ,Goiânia,,,,"Fiama Martins Cutrim (CUTRIM, F. M.), Kiany Sirley Brandão Cavalcante (CAVALCANTE, K. S. B.)"
3810732989135120,16042024,Trabalho em Evento,"Avaliação pedagógica da disciplina de Físico-química I ministrada no IFMA, campus São Luís/Monte Castelo",2015.0,Brasil,55º CBQ,Goiânia,,,,"Rayane Kelly Pereira Ribeiro (RIBEIRO, R. K. P.), Thaynara Ferreira Soares (SOARES, T. F.), Kiany Sirley Brandão Cavalcante (CAVALCANTE, K. S. B.)"
3810732989135120,16042024,Trabalho em Evento,Substâncias ácidas e básicas presentes no dia a dia - contextualizando o ensino de Química através de uma proposta alternativa e lúdica,2015.0,Brasil,55º CBQ,Goiânia,,,,"Thaynara Ferreira Soares (SOARES, T. F.), Rayane Kelly Pereira Ribeiro (RIBEIRO, R. K. P.), Kiany Sirley Brandão Cavalcante (CAVALCANTE, K. S. B.)"
3810732989135120,16042024,Trabalho em Evento,Tabuleiro ''Batalha de Químicos'': Uma estratégia lúdica de avaliação diagnóstica do conhecimento químico,2015.0,Brasil,55º CBQ,Goiânia,,,,"Fiama Martins Cutrim (CUTRIM, F. M.), Kiany Sirley Brandão Cavalcante (CAVALCANTE, K. S. B.)"
3810732989135120,16042024,Trabalho em Evento,Estudo da produção de açúcares redutores a partir da hidrólise do arroz residual,2013.0,Brasil,VIII CONNEPI,Salvador,,,,"Thaynara Ferreira Soares (SOARES, T. F.), Rayane Kelly Pereira Ribeiro (RIBEIRO, R. K. P.), Kiany Sirley Brandão Cavalcante (CAVALCANTE, K. S. B.)"
3810732989135120,16042024,Trabalho em Evento,Estudo da hidrólise ácida e enzimática da casca de macaxeira (Manihot esculenta),2014.0,Brasil,IX CONNEPI,São Luís,,,,"Thaynara Ferreira Soares (SOARES, T. F.), Rayane Kelly Pereira Ribeiro (RIBEIRO, R. K. P.), Kiany Sirley Brandão Cavalcante (CAVALCANTE, K. S. B.)"
3810732989135120,16042024,Trabalho em Evento,Hidrólise ácida e enzimática da casca de batata (Solanum tuberosum Lineu),2013.0,Brasil,Anais do VIII CONNEPI,Salvador,,,,"Rayane Kelly Pereira Ribeiro (RIBEIRO, R. K. P.), Thaynara Ferreira Soares (SOARES, T. F.), Kiany Sirley Brandão Cavalcante (CAVALCANTE, K. S. B.)"
3810732989135120,16042024,Trabalho em Evento,Construção de estruturas carbônicas: um recurso para o Ensino de Química Orgânica,2016.0,Brasil,XVIII Encontro Nacional de Ensino de Química (ENEQ),Florianópolis - SC,,,,"Matheus Henrique da Silva Ribeiro (RIBEIRO, M. H. S.), Emily Cristina Silva Sousa Ramos (RAMOS, E. C. S. S.), Fiama Martins Cutrim (CUTRIM, F. M.), Anailde Carvalho Costa (COSTA, A. C.), Clenilma Marques Brandão (BRANDAO, C. M.), Kiany Sirley Brandão Cavalcante (CAVALCANTE, K. S. B.)"
3810732989135120,16042024,Trabalho em Evento,Gincana 'Química em Velocidade Máxima': ações do PIBID no Centro de Ensino Médio Gonçalves Dias em São Luís - MA,2016.0,Brasil,XVIII Encontro Nacional de Ensino de Química (ENEQ),Florianópolis,,,,"Matheus Henrique da Silva Ribeiro (RIBEIRO, M. H. S.), Emily Cristina Silva Sousa Ramos (RAMOS, E. C. S. S.), Anailde Carvalho Costa (COSTA, A. C.), Clenilma Marques Brandão (BRANDAO, C. M.), Kiany Sirley Brandão Cavalcante (CAVALCANTE, K. S. B.)"
3810732989135120,16042024,Trabalho em Evento,A Química do Urucum: uma atividade contextualizadora no Ensino de Química Orgânica,2016.0,Brasil,XVIII Encontro Nacional de Ensino de Química (ENEQ),Florianópolis - SC,,,,"Fiama Martins Cutrim (CUTRIM, F. M.), Manuela Conceição Machado da Silva (SILVA, M. C. M.), Ruan Carlos Corvel Carvalho (CARVALHO, R. C. C.), Anailde Carvalho Costa (COSTA, A. C.), Kiany Sirley Brandão Cavalcante (CAVALCANTE, K. S. B.)"
3810732989135120,16042024,Trabalho em Evento,Ciência em Ação: Teatro Radioativo,2016.0,Brasil,II Encontro Nacional de Jogos e Atividades Lúdicas em Ensino de Química (Jalequim),Goiânia - GO,,,,"Aline Barbosa de Oliveira (OLIVEIRA, A. B.), Mali Raiol da Silva (SILVA, M. R.), Maria de Fátima Ribeiro Pavão (PAVAO, M. F. R.), Kiany Sirley Brandão Cavalcante (CAVALCANTE, K. S. B.)"
3810732989135120,16042024,Trabalho em Evento,A Química dos Protetores Solares: uma proposta de integração entre escola e instituição formadora - PIBID,2016.0,Brasil,56° CBQ,Belém - PA,,,,"Kiany Sirley Brandão Cavalcante (CAVALCANTE, K. S. B.), Matheus Henrique da Silva Ribeiro (RIBEIRO, M. H. S.), Anailde Carvalho Costa (COSTA, A. C.)"
3810732989135120,16042024,Trabalho em Evento,Vulcão Químico: uma experimentação no Ensino de Ciências,2016.0,Brasil,56° CBQ,Belém - PA,,,,"Kiany Sirley Brandão Cavalcante (CAVALCANTE, K. S. B.), Karyne Louise Brito Fonseca (FONSECA, K. L. B.), Allan Sampaio Godinho (GODINHO, A. S.)"
3810732989135120,16042024,Trabalho em Evento,Fermentação Alcoólica de Frutas: uma experiência pedagógica de Química Orgânica no Ensino Médio Integrado,2016.0,Brasil,56° CBQ,Belém - PA,,,,"Kiany Sirley Brandão Cavalcante (CAVALCANTE, K. S. B.), Thaynara Ferreira Soares (SOARES, T. F.), Angela Maria Correa Mouzinho (MOUZINHO, Angela Maria Correa)"
3810732989135120,16042024,Trabalho em Evento,Aproveitamento de biomassas amilacea e lignocelulosica residuais oriundas da agroindustria para produção de açucares redutores,2015.0,Brasil,X SEMINÁRIO DE INICIAÇÃO CIENTÍFICA (SEMIC),São Luís,,,,"Camila Maia Campelo (CAMPELO, C. M.), Kiany Sirley Brandão Cavalcante (K. S. B. Cavalcante)"
3810732989135120,16042024,Trabalho em Evento,Aproveitamento de biomassas amilacea e lignocelulosica residuais oriundas da agroindustria para produção de açucares redutores,2015.0,Brasil,X Seminário de Iniciação Científica (SEMIC),São Luís,,,,"Priscilla Fernanda Fernandes Rodrigues (RODRIGUES, P. F. F.), Kiany Sirley Brandão Cavalcante (K. S. B. Cavalcante)"
3810732989135120,16042024,Trabalho em Evento,Produção de poliuretano a partir de óleos vegetais,2015.0,Brasil,X Seminário de Iniciação Científica (SEMIC),São Luís,,,,"Antônio Marcos Pereira dos Santos (SANTOS, A. M. P.), Kiany Sirley Brandão Cavalcante (K. S. B. Cavalcante)"
3810732989135120,16042024,Trabalho em Evento,Produção de poliureno apartir de óleos vegetais,2014.0,Brasil,IX X Seminário de Iniciação Científica (SEMIC),São Luís,,,,"Antônio Marcos Pereira dos Santos (SANTOS, A. M. P.), Kiany Sirley Brandão Cavalcante (K. S. B. Cavalcante)"
3810732989135120,16042024,Trabalho em Evento,Produção de bio-etanol: hidrólise enzimática e fermentação etanólica de casca de legumes,2014.0,Brasil,IX Seminário de Iniciação Científica (SEMIC),São Luís,,,,"Rayane Kelly Pereira Ribeiro (RIBEIRO, R. K. P.), Kiany Sirley Brandão Cavalcante (K. S. B. Cavalcante)"
3810732989135120,16042024,Trabalho em Evento,Produção de bio-etanol a partir da hidrólise ácida e fermentação etanólica de biomassas oriundas de resíduos alimentares,2014.0,Brasil,IX Seminário de Iniciação Científica (SEMIC),São Luís,,,,"Thaynara Ferreira Soares (SOARES, T. F.), Kiany Sirley Brandão Cavalcante (K. S. B. Cavalcante)"
